Item Type Metadata:NewspaperText,Item Type Metadata:Date of meeting,Item Type Metadata:Place,geolocation:latitude,geolocation:longitude,geolocation:zoom_level,Item Type Metadata:Newspaper,Dublin Core:Date,itemType,geolocation:map_type,geolocation:address,Item Type Metadata:meeting date
"OLDHAM. - Mr. William Griffin, of Manchester, will lecture in the Chartist room, on Sunday, (tomorrow) at six o clock in the evening.",,Oldham,53.5415797,-2.1147831,7,Northern Star,01/01/1842,Meeting,,,
"UPPER WORTLEY. - Mr. Stansfeld will preach two sermons to-morrow, at Silver-royd-hill, in the afternoon, at two o clock, and in the evening; at six o'clock.",,Upper Wortley,53.78615685,-1.585932142,7,Northern Star,01/01/1842,Meeting,,,
"DELPH.   Mr. James Leach will deliver a lecture to the people of Saddleworth, in their lecture room, Delph, Saddleworth, on Monday, the 3rd of Jan., at seven o clock in the evening.",,Delph,53.568814,-2.023407,7,Northern Star,01/01/1842,Meeting,,,
"CHOWBENT.   Two lectures will be delivered tomorrow, in Harrison s Chapel. Mr. Barrow, of Colton, will lecture in the afternoon and Mr. Wm. Dixon, of Wigan, in the evening.",,Chowbent,53.5245797,-2.485065349,7,Northern Star,01/01/1842,Meeting,,,
"CHELSEA.   A public festival, consisting of a concert and ball, will be given in the spacious Temperance Hall, Lower George-Street, Sloane-square, for the benefit of the political martyrs who are now suffering in liberty s cause. Tickets, single 1s. each; double do. 1s. 6d. Tickets to be obtained of Mr. Stallwood, Little Vale Place; Mr. Ford, High-row, Knightsbridge; Mr. Cuffay, 409, Strand.",,Chelsea,51.4843682,-0.1793729,7,Northern Star,01/01/1842,Meeting,,,
"NOTTINGHAM.   On Sunday, Jan. 2, a county delegate meeting will be held in the Democratic chapel, at one o clock precisely, when it is particularly requested that every locality where the association has gained an establishment, will appoint a delegate to represent them, or else on no account to fail sending letters for or against Mr. Taylor s reappointment, addressed, post paid, to Mr. Wm. Russell, secretary to missionary fund, care of Mr. J. Sweet, Goosegate, Nottingham. Other business of importance will also be brought under the consideration of the meeting relating to the forthcoming convention.",,Nottingham,52.9549771,-1.1511066,7,Northern Star,01/01/1842,Meeting,,,
"STOCKPORT.   A grand concert will be held in the National Charter Association Room, Bomber's Brow, Monday, January 10. The proceeds of which are to be appropriated to a patriotic purpose. ",,Stockport,53.4077455,-2.1601108,7,Northern Star,01/01/1842,Meeting,,,
"BARNSLEY.   A public meeting will be held in the Odd Fellows' Hall, on Monday, Jan. 10, at half-past seven o clock, to adopt the National Petition. Mr. T. B. Smith, of Leeds, has promised to attend.",,Barnsley,53.5527719,-1.4827755,7,Northern Star,01/01/1842,Meeting,,,
"LECTURE.   Mr. Farrer will lecture or the repeal of the Corn Laws, on Sunday, at the Three Crowns, Richmond-street.",,Three Crowns,51.511651,-0.133876,7,Northern Star,08/01/1842,Meeting,,,
"LECTURE.   Mr. Stallwood will lecture on the principles of the Charter, on Sunday, at the Three Crowns, Richmond-street.",,Three Crowns,51.511651,-0.133876,7,Northern Star,08/01/1842,Meeting,,,
"SHEFFIELD.   The council will meet, on Sunday, at two o'clock precisely.",,Sheffield,53.3840547,-1.4683069,7,Northern Star,08/01/1842,Meeting,,,
"HALIFAX.   Mr. Bairstow, of Leicester, will deliver a lecture in the Charter Institution, this evening, (Saturday,) at seven o'clock.",,Halifax,53.725,-1.863,7,Northern Star,08/01/1842,Meeting,,,
"NEWCASTLE. - Mr. Bronterre O'Brien will deliver three lectures, in the New Lecture Room, Nelson-street, on the evenings of Monday, the 10th, Tuesday, the 11th, and Wednesday, the 12th. The latter open for discussion.",,Newcastle,54.9770924,-1.6142059,7,Northern Star,08/01/1842,Meeting,,,
"SACRISTON. - Mr. Mowbray will lecture here on Saturday, the 15th inst.",,Sacriston,54.8224259,-1.6376458,7,Northern Star,08/01/1842,Meeting,,,
"LEEDS. - Mr. Charlesworth will preach in the Association Room, as half-past two o'clock in thee afternoon; and Mr. Brook at half-past six in the evening.",,Leeds,53.7974185,-1.5437941,7,Northern Star,08/01/1842,Meeting,,,
"TODMORDEN. - The Rev. W. V. Jackson of Manchester, will preach three sermons, in the Mechanics' Institute, on Sunday, (to-morrow,) at half-past ten o'clock in the forenoon; in the afternoon at half-past two; and in the evening at six o'clock. Collections will be made after each sermon towards erecting a chapel for the minister and his congregation.",,Todmorden,53.713,-2.096,7,Northern Star,08/01/1842,Meeting,,,
BELPER. - A delegate meeting is to be holden on the 27th of February. Each neighbouring town and village is requested to send a delegate.,,Belper,53.0229029,-1.4817414,7,Northern Star,08/01/1842,Meeting,,,
"MR. CANDY, from Wolverhampton, wishes to announce that he is going through the West Riding of Yorkshire, next week, and will call on his way and address the Chartists of Bradford, Dewsbury, Todmorden and Halifax.",,Mr,,,7,Northern Star,08/01/1842,Tour,,,
"SOUTHAMPTON.   A public meeting will be held here on the evening of Tuesday, the 18th instant, to adopt the National Petition, and on other business.",,Southampton,50.9167526,-1.4004929,7,Northern Star,15/01/1842,Meeting,,,
"Derbyshire, Mr, Bairstow will lecture at the following places, at seven o clock each evening :  At Helper, on Monday, Jan. 17th ; Bonsall, on Tuesday, the 18th; Winster, on Wednesday, the 19th ; Matlock Bridge, on Thursday, the 20th ; Swanwich, on Friday, the 21st; and at Milford, on Saturday, the 22nd.",,"Derbyshire, Mr, Bairstow Will Leoture At The Following Places, At Seven O Clock Each Evening : At Helper, On Monday, Jan",,,7,Northern Star,15/01/1842,Tour,,,
"BROWN STREET. - Mr. Clarke, of Stockport, will lecture at Brown-street; Mr Stoven, at Salford. Mr Richard Littler, at Miles Platting; and Mr. William Bell, at York-street, Manchester.",,Brown Street,53.481074,-2.2424089,7,Northern Star,15/01/1842,Tour,,,
"DERBY. - A delegate meeting will be held in the Association Room, over the Co-operative Store, corner of Wright-street, Willow-row, Derby, on Sunday, 23rd instant, at eleven o'clock in the forenoon, when delegates will be expected from the following places : - Burton, Swadlingcote, Ilkeston, Heanor, Breason, and all other towns and villages in their locality.",,Derby,52.9212617,-1.4761491,7,Northern Star,15/01/1842,Meeting,,,
"Mr. Doyle's route for the ensuing week. - On Sunday, the 16th Jan. at Hazlegrove' Monday, at Mottram; Tuesday, at Wilmslow; Wednesday, at Northwich; on Thursday, at Middlewich; on Friday, at Nantwich.",,Mr,,,7,Northern Star,15/01/1842,Tour,,,
"MOTTRAM. - Mr. John Leach, of Hyde, will deliver a lecture in the Mottram Chartist Association Room on Sunday, at half-past two o'clock in the afternoon, on the necessity of an organic concentration of moral power to remove the evils impending on the industrious people of this country.",,Mottram,53.4576897,-2.0143757,7,Northern Star,15/01/1842,Meeting,,,
"COVENTRY. - Mr. Peter Hoey will lecture here on Friday, the 21st. ",,Coventry,52.4145039,-1.518763323,7,Northern Star,15/01/1842,Meeting,,,
"CHORLTON.   Mr. L. Bell will lecture in the National Charter Association room, York-street, Chorlton-upon-Medlock.",,Chorlton,53.4665349,-2.2535243,7,Northern Star,15/01/1842,Meeting,,,
"HYDE.   Mr. S. Sidebottom, of Newton, will deliver a lecture in the Working Man s Institution, Hyde, on Wednesday, January 19th, 1842, to commence at eight o clock in the evening. Admission one penny, for the benefit of the Institution.",,Hyde,53.4474,-2.082,7,Northern Star,15/01/1842,Meeting,,,
"LONDON.   It is expected Mr. O Connor will address aggregate meetings of the tailors and shoemakers, in the course of the ensuing week.",,London,51.5073219,-0.1276474,7,Northern Star,15/01/1842,Meeting,,,
"ROCHDALE.   Mr. Griffin, of Manchester, will lecture next Sunday, at half-past two in the afternoon, and six in the evening.",,Rochdale,53.6153659,-2.1557561,7,Northern Star,15/01/1842,Meeting,,,
"Mr. Wm. Belsley s Route.   On Sunday, Jan. the 23rd in Chorley ; Monday, the 24th, in Wigan ; Tuesday, the 25th, in Preston ; Wednesday, the 26th, in Clitheroe ; Thursday, the 27th, in Sabden ; Friday, the 28th, in Barnoldswink ; Saturday, the 29th in Colne; Sunday, the 30th, in Burnley; Monday, the 31st, in Todmorden ; and Feb. the 1st in Bucup.",,Mr,,,7,Northern Star,22/01/1842,Tour,,,
"Mr. Doyle s Route. On Monday, the 24th inst. in the city of Chester ; Tuesday, the 25th, in Nant-wich; Wednesday, the 26th, in Hanley, Staffordshire ; Thursday, the 27th, in Corigleton ; Saturday, the 29th, in New Mills; Sunday, the 30th in Macclesfield.",,Mr,,,7,Northern Star,22/01/1842,Tour,,,
"FINSBURY.   On Monday, a meeting in furtherance of the cause will be held at Lunt s Coffee House, Clerkenwell Green, at eight precisely.",,Finsbury,51.52291,-0.105886,7,Northern Star,22/01/1842,Meeting,,,
"MACCLESFIELD.   The Cheshire County Delegate Meeting will take place in Macclesfield National Charter Association rooms, at ten o clock in the forenoon of Sunday, the 30th of January, when every locality in the county, are requested to send a dele-gate, as the whole business of the ensuing three mouths will be brought before them; those who find it impracticable to send a delegate, will remit, through the comity lecturer, their amount of the county funds, namely, one penny per member, and all other payments by the same method.",,Macclesfield,53.2606635,-2.1255158,7,Northern Star,22/01/1842,Meeting,,,
"Mr. Leach will lecture in Macclesfield, on Monday, January 31st; in Hanley Potteries, Tuesday, February 1st; in Stafford, Wednesday, February 2d; in Bilston, Thursday, February 3rd; in Birmingham, February 4th; in Marylebone, Sunday, February 6th: and will meet his colleagues of the Executive in Bristol, on Monday, tho 7th day of Feb.",,Mr,,,7,Northern Star,22/01/1842,Tour,,,
"DEWSBURY.   A District Meeting will be held on Sunday, the 23rd instant, at two o clock in the afternoon, in the large room over the Co-operative Stores. It is particularly requested that the whole of the members in the district will attend, as business of the greatest importance will be brought forward.",,Dewsbury,53.6909103,-1.6302142,7,Northern Star,22/01/1842,Meeting,,,
"DELPH.   A public meeting will beheld this evening. to adopt the National Petition, Griffin and Connor, from Manchester, are invited.",,Delph,53.568814,-2.023407,7,Northern Star,29/01/1842,Meeting,,,
"The Weavers of London have at length aroused from their torpor, and are about to hold an aggregate meeting for the   Charter  in Spitalfields in the early part of the week.",,Spitalfields,51.5239026,-0.0673992,7,Northern Star,29/01/1842,Meeting,,,
"BLACK BULL INN, Hammersmith-Road.   A public meeting, for dispatch of business, will be held on Tue ihy next, at eight o clock precisely. The members are particularly requested to attend.",,"Black Bull Inn, Hammersmith-road",51.4943826,-0.217499,7,Northern Star,29/01/1842,Meeting,,,
"RED LION, KING-STREET, GOLDEN-SQUARE.   Mr. L. H. Leighs will lecture on free trade fallacies, on Sundry evening next.",,"Red Lion, King-street, Golden-square",51.512563,-0.139269,7,Northern Star,29/01/1842,Meeting,,,
"BILSTON.   A meeting of delegates for the Southern Division of Staffordshire, will be held in Bilston, on Sunday, the 23rd inst. The meeting to commence at two o clock in the afternoon.",,Bilston,52.5700229,-2.0822333,7,Northern Star,29/01/1842,Meeting,,,
"SOWERBY.   A ball will be held in the association room, on Shrove Tuesday, to commence at six o clock in the evening, the profits to go towards the expence of the fund for sending members to sit in the ensuing Convention.",,Sowerby,53.7055036,-1.9324388,7,Northern Star,29/01/1842,Meeting,,,
"LONDON.   On Wednesday, Feb. 2nd., Feargus O Connor, Esq., will deliver a lecture in the Hatter s National Charter Association Room, on the principles of the People s Charter, The attendance and co-operation of all Trades is earnestly requested.",,London,51.5073219,-0.1276474,7,Northern Star,29/01/1842,Meeting,,,
"Mr. Henry Candy s Route for next Week.   Monday, Jan. 31, Guildhall, Huddersfield, at eight o clock in the evening: Tuesday, Feb. 1st, School of Science, Shop-lane, Kirkheaton, at half-past seven o clock; Wednesday, Feb. 2d, Shipwreck Inn, Yew Green, at seven o clock; Thursday, Feb. 3rd, Grove Inn, Lepton, at eight o clock; Friday, Feb. 4th, at Paddock, at eight o clock; Saturday, Feb. 5th, at the house of Mr Wm. Rottill, Slaithwaite, at seven o clock in the evening.",,Mr,,,7,Northern Star,29/01/1842,Tour,,,
"HONLEY.   On Sunday, February 6th. the opening of the New Chartist Hall, Honley, will take place, when two lectures will be delivered; that in the afternoon, by Mr. Joseph Bray, to commence at half-past two o clock ; and in the evening, at six-o clock, by Mr. Henry Candy, the district missionary.",,Honley,53.6022372,-1.7891409,7,Northern Star,29/01/1842,Meeting,,,
"WESTBURY.   A delegate meeting will be held at Mr. Tucker s, on Sunday, Feb. 16th, at which it is expected the attendance of delegates will be full, an important business will be introduced.",,Westbury,51.26,-2.191,7,Northern Star,29/01/1842,Meeting,,,
"ROCHDALE.   Mr. Charles Connor will lecture here next Sunday, at half-past two o clock, in the association room, Yorkshire-street. All persons holding the National Petition sheets for signature, are requested to bring them in.",,Rochdale,53.6153659,-2.1557561,7,Northern Star,29/01/1842,Meeting,,,
"LOUGHBOROUGH.   Mr. Campbell will lecture here on Wednesday, February 2nd, at seven o'clock.",,Loughborough,52.7723859,-1.2077985,7,Northern Star,29/01/1842,Meeting,,,
"STROUD.   Mr. Knowles  Route.  On Monday, the 31st instant, at Tewkesbury ; on Tuesday, Feb. 1st, at Winchcomb; on Wednesday, the 2nd, at Cheltenham ; on Thursday, the 3d, at Cirencester ; on Friday, the 4th, at Tetbury ; on Saturday, the 5th, at Wotton-under-Edge ; and on Sunday, the 6th, at Stroud.",,Stroud,51.745424,-2.2198605,7,Northern Star,29/01/1842,Meeting,,,
"SWAIN GREEN.   Mr. Brook will lecture at the house of Mr. Robert Webster, Royal Oak Inn, at eight o clock.",,Swain Green,53.788616,-1.7183895,7,Northern Star,29/01/1842,Meeting,,,
"The Female Chartists of Manchester-road, Bradford, intend getting up a tea party and ball, at the house of Mr. James Sharpe, the Queen s Arms, on Shrove Tuesday, for the benefit of Messrs. Peddie, Brook, Walker, and Naylor, who are now in prison, having Suffered nearly two years imprisonment on account of the affair at Bradford, in 1840. Messrs Peddie and Brook have each one year longer to serve. A limited number of tickets only are issued, and those who wish to purchase them will do well to make an early application, they may be had at the following places at one shilling each, including both tea and ball:   Mr. James Ibbotson, bookseller, Bradford; Mr, Alder-son, tailor, Bank-street, Bradford ; Mrs. Smith, Thompson s Houses, Bradford; Mr. Smyth, Manchester road ; Mr. Elliss, Manchester-road ; Mr. Carodus, Wapping; Mr. Burrows, Great Horton; Mr. J. Horton, Little Horton Green; Mr. Brook, Little Horton.",,"The Female Chartists Of Manchester-road, Bradford, Intend Getting Up A Tea Party And Ball, At The House Of Mr",53.784179,-1.785005,7,Northern Star,29/01/1842,Meeting,,,
"BIRMINGHAM.   A delegate meeting will be held at the sign of the Ship, Steelhouse-lane, Birmingham, on Sunday, Feb. the 6th, when every town in the district is expected to send a delegate.",,Birmingham,52.4813679,-1.8980726,7,Northern Star,29/01/1842,Meeting,,,
"MANCHESTER.   There will be a meeting of the General Council in Manchester, at Brown-street Association Room, on Sunday, the 13th of February, at ten o clock in tho forenoon, when it is expected as many will attend as can make it convenient, as there is some very important business to be transacted.",,Manchester,53.481074,-2.2424089,7,Northern Star,05/02/1842,Meeting,,,
"BILSTON.   A meeting of delegates will be held in Bilston, Sunday, February 6th, when delegates from Walsall, Darlaston, Wednesbury, and Wolverhampton will be expected to attend.",,Bilston,52.5700229,-2.0822333,7,Northern Star,05/02/1842,Meeting,,,
"NORTH LANCASHIRE.   Mr. Lund s route - Monday, February 7, at Lancaster; Tuesday, 8th, at Preston ; Wednesday, 9th, at Clithero; Thursday, lOfch, at Sabden ; Friday, 11th, at Barnoldswick ; Saturday, 12th, at Colne; Monday, 14th, at Harwood; Tuesday, l0th,at Burnley; Wednesday, 16th, at Todmorden ; Thursday, 17th, at Bacup ; Friday, 18th, at Baxenden ; Saturday, 19th, at Chorley; and on Monday, 21st, at Blackburn.",,North Lancashire,,,7,Northern Star,05/02/1842,Tour,,,
"Mr. Knowles  Route for the ensuing week   On Monday, the 7th, at Gloucester; Tuesday, the 8th, at Fainswiek ; Wednesday, tho 9th, at Nailsworth ; Thursday, the 10th. at Uley ; Friday, the 11th, at Stanley ; Saturday, the 12th, at Chalford ; Sunday, the 13th, at Stroud.",,Mr,,,7,Northern Star,05/02/1842,Tour,,,
"STANNINGLEY.   Two lectures will bo delivered in the Chartist room, on Sunday, in the afternoon at two o clock, and in the evening at six o clock, by Thomas Ibbotson, of Bradford.",,Stanningley,53.806126,-1.6631631,7,Northern Star,05/02/1842,Meeting,,,
"Delegate Meeting.   An East and North Riding delegate meeting will beheld at Selby, on Sunday, the 20th, of the present month, at half-past ten o clock in the forenoon,",,Selby,53.781789,-1.070309,7,Northern Star,05/02/1842,Meeting,,,
"Mr. Henry Candy s Route for next Week.   Monday, February 7th, Holmfirth ; Tuesday, the 8th, New Mill ; Wednesday, the 9th, Newsome, at eight o'clock ; Thursday, tho 10th, Dalton, at eight o clock ; Friday, the 11th, at the Rose and Crown Inn, Longwood, at eight o clock; Saturday, the l2th, at the Waggon and Horses Inn, Out Lane, at seven o'clock.",,Mr,,,7,Northern Star,05/02/1842,Tour,,,
"HONLEY.   On Sunday, to-morrow, two lectures will be delivered in the new Chartist Hall, Honley, that in the afternoon at half-past two, by Joseph Bray ; and at six in the evening, byfHenry Candy.",,Honley,53.6022372,-1.7891409,7,Northern Star,05/02/1842,Meeting,,,
"Tea Party and Ball.   The female Chartists of Manchester Road are getting up a tea party and ball at the house of Mr. J. Sharp, the Queen s Arms Inn, for the benefit of the four Chartist victims, Messrs, Peddie, Brook, Walker, and Naylor. The whole of these have suffered two years  imprisonment in various Houses of Correction, and the two first named have each thirteen months longer to stay. Tiokets, price Is, each, to he hau of the following persons - Mr. Ibbotson, Mr. Smith, Mrs. Smith, Messrs. Heaton, Brook, Burrows, Carrodus, and Ellis.",,Tea Party And Ball,53.7772105,-1.7603548,7,Northern Star,05/02/1842,Meeting,,,
"ROCHDALE.   Mr. Bailey, of Manchester, will lecture in the Association room, Yorkshire-street, on Sunday, (to-morrow,) at half-past two in the afternoon.",,Rochdale,53.6153659,-2.1557561,7,Northern Star,12/02/1842,Meeting,,,
"NORTH SHIELDS.   On Tuesday, the 15th, Messrs. Williams and Chappie will visit this place for the purpose of lecturing, Tho place of meeting will be either the   Future Admiral,  or the "" George Inn,  near the Railway Station.",,North Shields,55.0125567,-1.4621511,7,Northern Star,12/02/1842,Meeting,,,
"Notice.   Andrew Weeks, of Leicester, will, in the next fortnight, visit all tho Chartist Associations direct from Leicester to Plymouth, and address them it convenient,",,Notice,,,7,Northern Star,12/02/1842,Tour,,,
"MACCLESFIELD.   Mr. West will lecture in the Association Room next Sunday, if not pre-engaged in some of the out-districts.",,Macclesfield,53.2606635,-2.1255158,7,Northern Star,12/02/1842,Meeting,,,
"A Meeting of Delegates from every town and village in the county of Chester, will be held in the Association Rooms, Watercotes, Macclesfield, on Sunday, the 20th instant, when it is expected no place will be unrepresented, as business of vital importance to the county and the good eause must be transacted.",,Macclesfield,53.2606635,-2.1255158,7,Northern Star,12/02/1842,Meeting,,,
"SELBY.   A delegate meeting will be held in the Association-room, Mr. George Woodal s, Temperance Hotel, Audus-street, Gowthorpe, on Sunday, the 20th instant, at halfpast ten o'clock in the morning.",,Selby,53.781789,-1.070309,7,Northern Star,12/02/1842,Meeting,,,
"A Meeting will be held at the Shoemaker s Club Rooms, the Clock House, Castle-street, Leicester-square, on Sunday, Feb. 13, for the purpose of forming a new locality. Mr. Wheeler will attend and explain the principles of the People's Charter.",,"A Meeting Will Be Held At The Shoemaker S Club Rooms, The Clock House, Castle-street, Leicester-square, On Sunday, Feb",51.5101773,-0.1302418,7,Northern Star,12/02/1842,Meeting,,,
"SHEFFIELD.   Mr. Beal will lecture in the Political Institute, Corn Exchange, at seven o'clock.",,Sheffield,53.3840547,-1.4683069,7,Northern Star,12/02/1842,Meeting,,,
"LEEDS DISTRICT.   A delegate meeting of this district will be held on Sunday, the 27th, February, in the association room, Holbeck, near the bridge.",,Holbeck,53.7819971,-1.5676975,7,Northern Star,19/02/1842,Meeting,,,
"NORTH LANCASHIRE.   A delegate meeting will take place at Accrington, on Sunday, Feb. 27th. The different places forming the district are requested to send delegates, as there is business of importance to transact.",,Accrington,53.7460428,-2.3519865,7,Northern Star,19/02/1842,Meeting,,,
"Mr. Lund s Route for North Lancashire.  Blackburn, Monday, Feb. 21st; Preston, the 22nd ; Lancaster, the 23rd ; Ulverstone, the 24th ; Kendal, the 25th ; Kirkby Lonsdale, the 26th ; Settle, the 28th ; Barnoldswick, March 1st; Clithero, the 2nd; Sabden, the 3rd ; Colne, the 4th ; Padiham, the 6th; Blackburn, the 7th.;'Harwood, the 8th ; Bromley, 9th ; Bacup, l0th; Baxenden, the 11th ; Chorley, the 12th.",,Mr,,,7,Northern Star,19/02/1842,Tour,,,
"CHOWBENT.   Mr. Isaac Barrow, of Bolton will deliver two lectures in Harrison s Chapel, Chowbent. The lectures to commence at half-past two in the afternoon, and six o clock in the evening.",,Chowbent,53.5245797,-2.485065349,7,Northern Star,19/02/1842,Meeting,,,
"MILNROW.   Mr. Joseph Linney, of Manchester, will deliver a lecture in the Association Room, on the 26th instant, at six o clock in the evening.",,Milnrow,53.6082511,-2.1099476,7,Northern Star,19/02/1842,Meeting,,,
"DERBYSHIRE. - A delegate meeting will be holden at the house of Mr. J. Vickers, Bridge-street, Belper, on Sunday, Feb. 27. Delegates are expected from each locality in the district, and the petition sheets to be brought in.",,Derbyshire,53.1185033,-1.556617831,7,Northern Star,19/02/1842,Meeting,,,
"P. M. BROPHY, late secretary of the Irish Universal Suffrage Association, will lecture at the following places: - at Baccup, on the 22nd inst.; Todmorden, 24th; Hebden Bridge, 25th; Halifax, 27th; Keighley, 28th; Bingley, the 1st of March; and at Bradford on the 2ns.",,P,,,7,Northern Star,19/02/1842,Tour,,,
"STOCKPORT YOUTHS.   On the 23d inst., Mr. Thomas Kindle will lecture on the present distressed state of the country, aud its remedies.",,Stockport Youths,53.4077455,-2.1601108,7,Northern Star,19/02/1842,Meeting,,,
"BRADFORD.   Mr. Jennings will lecture at the Mason s Arms, Club Houses, to night, at eight o clock.",,Bradford,53.7941567,-1.7494778,7,Northern Star,19/02/1842,Meeting,,,
"ROCHDALE.   Mr. John Leach, of Hyde, will lecture in the Association room, York-street, on Sunday, (to-morrow,) at half-past two o clock in the afternoon.",,Rochdale,53.6153659,-2.1557561,7,Northern Star,19/02/1842,Meeting,,,
"Mr. Dewhurst will lecture at Clithero, on Saturday, the 19th instant ; at Sabden, on Monday, 21st; Padiham, the 22nd; Baxendon, the 23rd; Preston, the 24th ; Chorley, the 26th.",,Mr,,,7,Northern Star,19/02/1842,Tour,,,
"Mr. Edwards will lecture at the following places: at Halifax, on Sunday, the 20th ; Mixenden the 21st; Sowerby, the 22nd ; Mytholmroyd, the 23rd ; Hebden-bridge, the 24th.",,Mr,,,7,Northern Star,19/02/1842,Tour,,,
"Shoemakers. - A ball and Concert will be held at the Social Hall, John-street, on Monday, the 16th of March, for the benefit of the funds for the ensuing Convention. ",,Shoemakers,53.577694,-2.4288874,7,Northern Star,12/03/1842,Meeting,,,
"MARYLEBONE.   Mr.Cameron will lecture at No. 5 Circus-street, on Sunday, the 13th instant. Chair to be taken at half-past seven.",,Marylebone,51.5203722,-0.16248,7,Northern Star,12/03/1842,Meeting,,,
"Mr. West will lecture in Halifax on Saturday, (to-day,) and in Dewsbury on Sunday, (to-morrow.)",,Mr,,,7,Northern Star,12/03/1842,Tour,,,
"Mr. Edwards s Route for the next week On Sunday, the 13th, at Dewsbury ; on Monday, the 14th, at Barnsley; on Tuesday, the 15th, at Sheffield; on Wednesday, the 16th, at Brampton, Derbyshire ; on Thursday, the 17th, at Mansfield, Nottinghamshire ; on Saturday, the 19th, at Sutton-in-Ashfield.",,Mr,,,7,Northern Star,12/03/1842,Tour,,,
"HATHORNE.   A delegate meeting will be Held at Hathorne, at ten o clock in the morning, at Mr. James Baker s, to take into consideration the instruction to the members of the General Convention, and other important business, when delegates from Hathorne, Sheepshead, Belton, Whatton, Diseworth, Donington, Kegworth, Sutton, Normanton, and Leake are requested to attend.",,Hathorne,,,7,Northern Star,12/03/1842,Meeting,,,
