Item Type Metadata:NewspaperText,Item Type Metadata:Date of meeting,Item Type Metadata:Place,geolocation:latitude,geolocation:longitude,geolocation:zoom_level,Item Type Metadata:Newspaper,Dublin Core:Date,itemType,geolocation:map_type,geolocation:address,Item Type Metadata:meeting date"DEWSBURY.   A district council meeting will be held on Sunday, October 1st, in the large room over the Stores, at one o clock in the afternoon, and it is particularly requested that persons holding money belonging to Dewhirst s Defence Fund will forward it to the above meeting,",,Dewsbury,53.6909103,-1.6302142,7,Northern Star,24/09/1842,Meeting,,,
"KIRKHEATON.   Mr. James Shaw will lecture in the Association Room, Kirkheaton, on Sunday, (to-morrow) ; chair to be taken precisely at six o olock.",,Kirkheaton,53.660129,-1.726188,7,Northern Star,24/09/1842,Meeting,,,
"HONLEY.   Mr. William Cunningham will lecture in the Association Room, Honley, on Sunday, (tomorrow); the chair to be taken precisely at six o olook.",,Honley,53.6022372,-1.7891409,7,Northern Star,24/09/1842,Meeting,,,
"HOLMFIRTH.   Mr. Edward Clayton will lecture here on Sunday, (to-morrow); the chair to be taken at six o clock.",,Holmfirth,53.5703632,-1.7870544,7,Northern Star,24/09/1842,Meeting,,,
"NEW ROAD.   A Concert and other Entertainments will take place at the Mechanics  Institution, Circus-street, New Road, on Friday, Oct. 7th, to aid Mr. Samuel Mundin. Tickets, 6d. each, to be had at the Bar of the Tavern; at the various Chartist localities, and at the Working Men's Hall, 5, Circus Street. The proceeds of tho evening will be presented to Mr. Mundin as a tribute of respect, a partial recompence for his imprisonment; and to defray the expenses attending his trial.",,New Road,51.5203722,-0.16248,7,Northern Star,01/10/1842,Meeting,,,
"The monthly meeting of the members will take place in the above Hall, at ten o clock in the forenoon, of the same day.",,Manchester,53.4791466,-2.2447445,7,Northern Star,01/10/1842,Meeting,,,
"Letters from Mr. Harney, who will attend the trials at Stafford, will be read at the meetings to be held in Fig Tree-lane Room during the week.",,Sheffield,53.3840547,-1.4683069,7,Northern Star,01/10/1842,Meeting,,,
"OVENDEN.   Mr. Wallace, of Halifax, will preach in the Association Room, Ovenden, on Sunday, (tomorrow,) at two o clock in the afternoon.",,Ovenden,53.7422293,-1.8752329,7,Northern Star,01/10/1842,Meeting,,,
"MIXENDEN STONES.   Mr. Butterley, of Halifax, will preach here on Sunday, (tomorrow,) at two o clock in the afternoon.",,Mixenden Stones,53.7520374,-1.9077035,7,Northern Star,01/10/1842,Meeting,,,
"ROCHDALE.   Mr. Pontefract, of Saddleworth, will lecture in the Association Room, Yorkshire-street, at half-past two in the afternoon, and at six in the evening.",,Rochdale,53.6153659,-2.1557561,7,Northern Star,01/10/1842,Meeting,,,
"BOLTON.   Mr. Isaac Barrow will deliver a lecture on the nation s curse, in the Association Room, Howell Croft, on Sunday, at six o clock.",,Bolton,53.577694,-2.4288874,7,Northern Star,01/10/1842,Meeting,,,
"HALIFAX.   Mr. B. Rushton will preach in the large room, Swan Coppice, on Sunday, (tomorrow,) at six o clock in the evening.",,Halifax,53.725,-1.863,7,Northern Star,01/10/1842,Meeting,,,
BIRSTAL.   Mr. T. B. Smith will visit the friends at Birstal this evening (Saturday).,,Birstal,53.730819,-1.663461,7,Northern Star,01/10/1842,Meeting,,,
"THURSTONLAND.   Mr. T. Vickerman, a young man from Hanley, will lecture here on Sunday, the sixth of Oct., in the open air, weather permitting, to commence at six o'clock.",,Thurstonland,53.5899953,-1.7509898,7,Northern Star,08/10/1842,Meeting,,,
"BRADFORD, YORKSHIRE.   Mason s Arms, Clubhouses.  The Chartists connected with this locality are respectfully invited to attend, on Saturday, (this day) an business of great importance is to be transacted, at half-past seven o'clock in the evening.",,Bradford,53.7941567,-1.7494778,7,Northern Star,08/10/1842,Meeting,,,
"BRADFORD.   The Chanists of Manchestor-road are requested to meet on Sunday, at six o clock in the evening, at Mrs. Hill s, on business of importance.",,Bradford,53.7941567,-1.7494778,7,Northern Star,08/10/1842,Meeting,,,
"A meeting of the Chartists of Crossley Hall will be held on Sunday, at two o clock.",,Crossley Hall,53.7972464,-1.7996379,7,Northern Star,08/10/1842,Meeting,,,
"MEXBRO' DISTRICT.   A delegate meeting will be held at Mexbro', on Sunday, Oct. 16th, at half-past ten o clock in the morning, at the Cross Keys puoiic-house, New Mexbro'.",,Mexbro' District,53.4984285,-1.266393,7,Northern Star,08/10/1842,Meeting,,,
"ROCHDALE.   Mr. Heywood, of Heywood, will preach two sermons in the Association Room, Yorkshire-street, on Sunday, at half-past two in the afternoon, and six in the evening ; and on Tuesday, Mr. Bell, of the same place, will lecture in the above room, at eight o'clock precisely.",,Rochdale,53.6153659,-2.1557561,7,Northern Star,08/10/1842,Meeting,,,
"DERBY.   There will be a Delegate Meeting on next Sundav at ten o'clock in the morning at the Chartist Room, Willow-row, to devise means for defending the incarcerated Chartists. Delegates are expected from all the localities in the county.",,Derby,52.9212617,-1.4761491,7,Northern Star,08/10/1842,Meeting,,,
"HONLEY.   Mr. Shaw will lecture hero on Sunday, (to-morrow,) to commence at six o clock in tho evening.",,Honley,53.6022372,-1.7891409,7,Northern Star,08/10/1842,Meeting,,,
"KIRKHEATON.   Mr. Edward Clayton will lecture in the Association Room, to commence at six o clock in the evening.",,Kirkheaton,53.660129,-1.726188,7,Northern Star,08/10/1842,Meeting,,,
"SOUTH SHIELDS.   Mr. P. M. Brophy will lecture here on Monday, the 19th of October, at seven o'clock in tho evening.",,South Shields,54.992,-1.429,7,Northern Star,08/10/1842,Meeting,,,
"SUNDERLAND. - Mr. P. M. Brophy will lecture here on Tuesday, the llth of October.",,Sunderland,54.9063791,-1.375053,7,Northern Star,08/10/1842,Meeting,,,
"HEBDEN BRIDGE. - A ball will be held in the Democratic Chapel, at the above place, on Friday, the 14th inst., to commence at six o olock in the evening.",,Hebden Bridge,53.7407227,-2.0093753,7,Northern Star,08/10/1842,Meeting,,,
"LONDON.   The Chartists of the Tower Hamlets have engaged the Pavillion Theatre, Whitechapel, for a benefit for the political victims, to take place on Wednesday, October 26. Box tickets 2s. Pit 1s. Gallery 6d.",,London,51.51859,-0.062924,7,Northern Star,15/10/1842,Meeting,,,
"THE SOMERS TOWN VICTIM COMMITTEE intend getting up a second harmonic meeting for the benefit of the victims, on Wednesday, the 19th instant, at the Cheshire Cheese, Philips  Buildings, Somers Town. To commence at half-past seven o clock precisely. Admission, 2d.",,"The Somers Town Victim Committee Intend Getting Up A Second Harmonic Meeting For The Benefit Of The Victims, On Wednesday, The 19th Instant, At The Cheshire Cheese, Philips Buildings, Somers Town",51.5299208,-0.1279282,7,Northern Star,15/10/1842,Meeting,,,
"MARYLEBONE.   A good time-piece,in a substantial mahogany case, well worth two guineas, will be raffled for, for the benefit of tho victims, as soon as thirty subscribers at one shilling each can be obtained.",,Marylebone,51.5203722,-0.16248,7,Northern Star,15/10/1842,Meeting,,,
"Mr. Skelton will lecture at the Working Men s Hall, Circus-street, Marylebone, on Sunday, (tomorrow,) evening, at half-past seven.",,Mr,51.5203722,-0.16248,7,Northern Star,15/10/1842,Meeting,,,
"SILK WEAVERS' LOCALITY.   The members of this locality are requested to attend a public meeting this (Saturday) evening, at eight o clock, to nominate members of the General Council, and a delegate to sit on the County Council, 55, Old Bailey. The meeting will be held at Mr. Arrowsmith s, the Halifax Arms, King Edward-street,Mile End, New Town.",,Silk Weavers' Locality,51.5146069,-0.1023808,7,Northern Star,15/10/1842,Meeting,,,
"NEWARK.   The Chartists of this place intend having a dinner on the opening of the large room which they have engaged on Blondsj, the 24fch October, and they would very much like for P. M. Brophy to visit them om that day if he can make it convenient. He should communicate with Thomas Simnett, Newark.",,Newark,53.0765,-0.81,7,Northern Star,15/10/1842,Meeting,,,
"SILSDEN.   Mr. Benjamin Rushton, from Ovenden, will preach two sermons in the Chartist Room, on Sunday, the 23rd of October. Service to commence at two o clock in the afternoon, and at six in the evening. Collections will bo made towards defending the Chartist prisoners.",,Silsden,53.9211034,-1.9189773,7,Northern Star,15/10/1842,Meeting,,,
"ECKINGTON.   The same evening Mr. Edwin Gill will lecture to the Chartists of this place, at five o clock, when a collection will be made for the incarcerated victims.",,Eckington,53.3089836,-1.3557936,7,Northern Star,15/10/1842,Meeting,,,
Evening Star Class.   A class for the daily reading of the Evening Star is formed at Mr. Williams s. Persons wishing to join must apply to Mr. Williams.,,Sunderland,54.9063791,-1.375053,7,Northern Star,15/10/1842,Meeting,,,
"SIDALL.   On Sunday, (to-morrow) Mr. Butterly, of Halifax, will preach in the Association Room; to oommence at six o clock iu tho evening.",,Sidall,53.7084045,-1.848841,7,Northern Star,15/10/1842,Meeting,,,
"HALIFAX.   On Sunday, (to-morrow) Mr. Wallace will preach in the large room, Swan Coppice, at six o clock in the evening.",,Halifax,53.725,-1.863,7,Northern Star,15/10/1842,Meeting,,,
"District Meeting.   The monthly district meeting will be held in the Large Room, Swan Coppice, Halifax, (to-morrow,) at two o clock in the afternoon.",,Halifax,53.725,-1.863,7,Northern Star,15/10/1842,Meeting,,,
"Leeds District. Mr. Dean Taylor will deliver lectures in the following places during the next week :   On Monday, the 17th inst., at Churwell; Tuesday, the 18th, at Hunslet; Wednesday, the 19tb, at Leeds, and on Friday, the 21st, at Morley.",,Leeds,53.7974185,-1.5437941,7,Northern Star,15/10/1842,Meeting,,,
"LEEDS.   Mr. Dean Taylor will preach two sermons to-morrow, in the afternoon, at half-past two, and half-past six o olock in the evening, in the Chartist room, Cheapside. ",,Leeds,53.7974185,-1.5437941,7,Northern Star,15/10/1842,Meeting,,,
"LIVERPOOL.   The Chartists are requested to attend in the Association Room, Preston-street, on Sunday, (to-morrow,) at eight o'clock in the evening, on business of importance.",,Liverpool,53.4054719,-2.9805393,7,Northern Star,15/10/1842,Meeting,,,
"THE PAVILLION theatre has been taken for the benefit of the political victims, by the Tower Hamlet Chartists, and several excellent pieces will be produced on Wednesday, Oct. 26th.",,Pavillion Theatre,51.51859,-0.062924,7,Northern Star,22/10/1842,Meeting,,,
"Mr. JAMES will deliver a lecture on Saturday, (this day,) at 1, China Walk.",,China Walk,51.495397,-0.1126751,7,Northern Star,22/10/1842,Meeting,,,
"QUEENSHEAD.   On Sunday, (to-morrow,) Mr. Wallace will preach in the Association Room, Street-end, at six o clock in the evening.",,Queenshead,,,7,Northern Star,22/10/1842,Meeting,,,
"SIDDALL.   On Sunday, (to-morrow,) Mr. A. Hanson will preach in the Association Room, at six o clock in the evening.",,Siddall,53.7084045,-1.848841,7,Northern Star,22/10/1842,Meeting,,,
"TEA PARTY.   On Monday, Nov. 7, there will be a tea party held in the above room, after which the friends will be addressed by Messrs. Hanson, Wallace, and Butterley.",,Siddall,53.7084045,-1.848841,7,Northern Star,22/10/1842,Meeting,,,
"DEWSBURY DISTRICT.   A counsel meeting will be held on Sunday, Oct. 30th, in the Largo Room over the Stores, at two o clock in the afternoon; delegates are requested to attend from all parts of the district.",,Dewsbury District,53.6909103,-1.6302142,7,Northern Star,22/10/1842,Meeting,,,
"Mr. WM. CUNNINGHAM will lecture at Almondbury on Saturday, (to-day), at half-past-six.",,Almondbury,53.6317366,-1.7458804,7,Northern Star,22/10/1842,Meeting,,,
"Mr. LISTER will visit Thurstonland on Sunday, at half-past two o clock in the afternoon; Honley, Sunday, the 30th; and Yew Green, on Sunday, November the 6th.",,Mr,,,7,Northern Star,22/10/1842,Tour,,,
"NOTICE.   The Evening Star is read daily at the Association room, Bamber s Brow.",,Stockport,53.4077455,-2.1601108,7,Northern Star,22/10/1842,Meeting,,,
"THE FRIENDS at Heaton Norris are informed that the Northern Star, Evening Star, Chartist Circular, and all other out and out democratic journals, together with the London Times, will be read every night at the house of Mr. James Mitchell, Heaton-lane. This arrangement has been made to accomodate those who live a great distance from the Association room.",,Heaton Norris,53.4157868,-2.1788882,7,Northern Star,22/10/1842,Meeting,,,
"A RAFFLE will take place at the Ship, sixpence a member, for a portrait of Feargus O'Connor, Esq., splendidly framed; the proceeds to be given to the defence fund.",,Birmingham,52.4813679,-1.8980726,7,Northern Star,22/10/1842,Meeting,,,
"KEIGHLEY DISTRICT.   The next delegate meeting of this district will be held in the Working Man's Hall, Sun-street, Keighley, on Sunday, October the 30th, at ten o clock in the forenoon.",,Keighley District,53.8684021,-1.9020456,7,Northern Star,22/10/1842,Meeting,,,
"Mr. WM. CUNNINGHAM will lecture this evening in the Town Hall, Almondbury.",,Almondbury,53.6317366,-1.7458804,7,Northern Star,22/10/1842,Meeting,,,
"A LECTURE will be delivered in the Association Room, Thurstonland, by Mr. Lister, on Sunday, (to-morrow) at half-past two o'clock.",,Thurstonland,53.5899953,-1.7509898,7,Northern Star,22/10/1842,Meeting,,,
"OLDHAM.   Mr. Michael Roberts, of Bury, will lecture in the Chartist Room, Greave-st., at six o clock in the evening.",,Oldham,53.5415797,-2.1147831,7,Northern Star,29/10/1842,Meeting,,,
"A District delegate meeting will be held at New Pellon, on Sunday, at two o clock in the afternoon. Delegates are expeoted to attend from Halifax, Sowerby, Ripponden, Luddenden, Upper Warley, Lower Warley, Mixenden, Ovenden. New Pellon, Siddle, Elland, &c , &c. It is hoped that none will fail to attend.",,New Pellon,53.7295274,-1.8927381,7,Northern Star,29/10/1842,Meeting,,,
"HOLMFIRTH.   Mr. William Cunningham will lecture on Sunday, (to-morrow), in the Association room, Holmfirth, to commence at six o clook in the evening.",,Holmfirth,53.5703632,-1.7870544,7,Northern Star,29/10/1842,Meeting,,,
"THURSTONLAND.   Mr. Edward Clayton will lecture on Sunday, (to-morrow), in the Democratic Chapel, Thurstonland, to commence at half-past two o clock in the afternoon.",,Thurstonland,53.5899953,-1.7509898,7,Northern Star,29/10/1842,Meeting,,,
"The monthly meeting of the members of the National Charter Association will be held in the Carpenters  Hall, on Sunday, the 6th of November, chair to be taken at ten o clock in the forenoon. It is requested that the members will be punctual in their attendance,",,Manchester,53.4749,-2.23508,7,Northern Star,29/10/1842,Meeting,,,
"HEYWOOD.   Mr. Heywood will preach two sermons in the National Charter Association Room, Harrley-street, on Sunday, Nov. 6th, at half-past two and six o clock.",,Heywood,53.5858251,-2.2339204,7,Northern Star,29/10/1842,Meeting,,,
"HALIFAX.   On Monday, Nov, 7th, there will be a ball held in the large room, Swan Coppice, for the benefit of a distressed fomily ; to commence at seven o clock in the evening. Admittance three-pence each.",,Halifax,53.725,-1.863,7,Northern Star,29/10/1842,Meeting,,,
"OLD BAILEY.   The committee of shareholders meet for the purpose of raising means by shares of five shillings each, for the purpose of taking a large Hall, the present being quite inefficient.",,Old Bailey,51.5146069,-0.1023808,7,Northern Star,05/11/1842,Meeting,,,
"On Tuesday, a concert will take place, for the purpose of raising the funds of the Association.",,Old Bailey,51.5146069,-0.1023808,7,Northern Star,05/11/1842,Meeting,,,
"On Thursday, a discussion will take place. The subject will be, that woman is constitutionally qualified to exercise political functions, between Mr. T. Powell and Mr. L. Cowan. ",,Old Bailey,51.5146069,-0.1023808,7,Northern Star,05/11/1842,Meeting,,,
"1 CHINA WALK, LAMBETH.   A lecture will be delivered at this place on Tuesday, at half-past eight o'clock in the evening; after which business of the greatest importance connected with the members of this locality will be brought before the meeting.",,"1 China Walk, Lambeth",51.495397,-0.1126751,7,Northern Star,05/11/1842,Meeting,,,
"WADSWORTH.   On Sunday, (to-morrow), the Rev, W, V. Jackson, from Manchester, will preach three sermons in the Chartist room.",,Wadsworth,51.4568435,-0.1933228,7,Northern Star,05/11/1842,Meeting,,,
"The Chartists of York intend having a ball in their Association Room, Ebor Tavern, Fossgate, on the evening of Martinmas Day, when they hope to receive the support of all Chartists visiting York on that day from the East and North Ridings. Tickets may be had at the room.",,York,53.9583807,-1.0786396,7,Northern Star,05/11/1842,Meeting,,,
"TODMORDEN.   Mr. James Leach will deliver two lectures in the Odd-Fellows -hall, on Sunday, November the 13th, at two o clock and at six.",,Todmorden,53.713,-2.096,7,Northern Star,05/11/1842,Meeting,,,
"BIRMINGHAM.   The Chartists meeting at the Washington Rooms, Hill-street, are requested to meet at Mr. Fussell s, 80, Bardsley-street, on Sunday, at half-past ten in the morning, on business of importance.",,Birmingham,52.4813679,-1.8980726,7,Northern Star,05/11/1842,Meeting,,,
"KIRKHEATON.   Mr. Edward Clayton will lecture in the Association Room, Kirkheaton. on Sunday, to-morrow, at six o clock. Subject   Past history, present position, and future prospects of Chartism. Discussion invited.",,Kirkheaton,53.660129,-1.726188,7,Northern Star,05/11/1842,Meeting,,,
"LIVERPOOL.   A Chartist ball will be held in the Association Room, Preston-street, next Monday, Dancing to commence at eight o clock ; doors to open at seven ; tickets 6d. each.",,Liverpool,53.4054719,-2.9805393,7,Northern Star,05/11/1842,Meeting,,,
"MOTTRAM.   At the council meeting, on Sunday, the secretary was instructed to call the class-leaders and members together on Sunday, November 6th, at two o clock in the afternoon, on business of the most vital importance.",,Mottram,53.4576897,-2.0143757,7,Northern Star,05/11/1842,Meeting,,,
"THE NORTH LANCASHIRE DELEGATE MEETING will be held at Mr. Richard Hasping's Temperance Hotel, Derwen-street, Blackburn, on Sunday, the 13th of November.",,Blackburn,53.7497193,-2.4797543,7,Northern Star,05/11/1842,Meeting,,,
"Mr. R. G. Gammage, of Northampton, will deliver lectures at the following places :  Brighton, Nov. 9th and 10th; Lewes, 11th; Tunbridge Wells, 12th and 13th.	",,Mr,,,7,Northern Star,05/11/1842,Tour,,,
"UPPER WARLEY.   Mr. B. Butterley will preach at this place on Sunday, (to-morrow), at two o clock in the afternoon.",,Upper Warley,53.7123893,-1.8993857,7,Northern Star,05/11/1842,Meeting,,,
"QUEEN'S HEAD.   Mr. B. Butterley will preach here on Sunday, at six o clock in the evening.",,Queen's Head,,,7,Northern Star,05/11/1842,Meeting,,,
"Mr. Fussell will lecture on Sunday, at the Star, Golden-lane, subject  Man, his history and destiny.",,Star  ,51.5213731,-0.0942386,7,Northern Star,12/11/1842,Meeting,,,
"All persons holding tickets or money for the late lottery at the Chartist Hall, Old Bailey, are requested to settle for the same on or before Sunday, to-morrow, as a balance will be issued on Nov. 14th, and the names of the defaulters published,",,Old Bailey,51.5146069,-0.1023808,7,Northern Star,12/11/1842,Meeting,,,
"DEWSBURY.   A district council meeting will be held on Sunday, in the Large Room, over the Stores, at two o clock in the afternoon, when delegates are requested to attend from all parts of the district.",,Dewsbury,53.6909103,-1.6302142,7,Northern Star,12/11/1842,Meeting,,,
"A Young Man, from Leeds, has presented to the Carlisle Council, a beautiful waistcoat piece, which will be raffled for on Saturday, the 39th instant. A member of the Council has promised to make it up for the winner. The tickets are to be one penny each, and the proceeds are to go to the Defence Fund.",,Carlisle,54.8955354,-2.9347352,7,Northern Star,12/11/1842,Meeting,,,
"ROCHDALE.   Mr. Smethurst will lecture in the Association room, Yorkshire-street, on Sunday, (to-morrow) and half-past two in the afternoon, and six in the evening.",,Rochdale,53.6153659,-2.1557561,7,Northern Star,12/11/1842,Meeting,,,
"Mr, James Leach will lecture in the Association room, on Wednesday, at eight o clock.",,Rochdale,53.6153659,-2.1557561,7,Northern Star,12/11/1842,Meeting,,,
"BOLTON.   Mr. James Leach, of Manchester, will deliver a lecture on the 15th instant, in tho Working men s Association room, Howel Croft, at seven o clock in the evening.",,Bolton,53.577694,-2.4288874,7,Northern Star,12/11/1842,Meeting,,,
"SHEFFIELD.   Fig-tree-lane. The weekly harmonic meeting, in aid of the defence fund, will be held this evening (Saturday), at half-past seven o clock.",,Sheffield,53.3840547,-1.4683069,7,Northern Star,12/11/1842,Meeting,,,
"The Chartists of York will have a ball in their meeting room, Ebor Tavern, Foss-gate, on the evening of Martinmas day, to commence at eight o clock. Tickets, sixpence each, to be had at the Ebor Tavern ; Mr. Samuel Hardcastle s, Walmgate ; and Mr. Robert Gill, J, Bilston-strcet, Layerthorpe   The Chartists of the East and North Riding visiting York upon that day are solicited to attend.",,York,53.9583807,-1.0786396,7,Northern Star,12/11/1842,Meeting,,,
"Mr. Farrer will lecture at the Britannia, Upper-Chapman-street, St. George s East, on Sunday, at eight o clock.",,Britannia,51.5121971,-0.0573278,7,Northern Star,19/11/1842,Meeting,,,
"The Members of the Britannia locality, Upper-Chapman-street, are requested to attend a general meeting on Sunday, at seven o clock in the evening, on business of the greatest importance to this locality.",,Britannia,51.5121971,-0.0573278,7,Northern Star,19/11/1842,Meeting,,,
"BRADFORD.   The Female Chartiets of Manchester Road are requested to meet on Sunday, at two o clock, at the house of Mr. Smyth, Thomas-street.",,Bradford,53.7941567,-1.7494778,7,Northern Star,19/11/1842,Meeting,,,
"The Chartists of Great Horton meet every evening in their Room, where the Evening Star, Chartist Circular, and other tracts are read. A few more subscribers to the library are wanting to complete the full number according to rule.",,Bradford,53.7941567,-1.7494778,7,Northern Star,19/11/1842,Meeting,,,
"The Chartists who are desirous of establishing a School on Sundays, in the Large Room, Butter-worth-buildings, are requested to attend on Sunday, at twelve o clock.",,Bradford,53.7941567,-1.7494778,7,Northern Star,19/11/1842,Meeting,,,
"KEIGHLEY DISTRICT.   The next meeting of this district will be holden in the Working Man s Hall, Sun-street, Keighley, on Sunday, November 30th, at ten o clock in the forenoon. The delegates are particularly requested to be punctual to the time. Delegates from every locality are solicited.",,Keighley District,53.8684021,-1.9020456,7,Northern Star,19/11/1842,Meeting,,,
"YORK.   Chartist Balls. The Chartists will have a ball in their large meeting room, Fossgate, on the evening of Martinmas day, Nov. 25th. In consequence of the rapid sale of tickets, the committee are convinced that tho above room will not be sufficiently large to accommodate the great number who have already promised their support, they have therefore engaged another large room at the Yorkshireman Coffee House, Coppergate, where another ball will be held on the same evening. Both balls will commence at eight o clock.",,York,53.9583807,-1.0786396,7,Northern Star,19/11/1842,Meeting,,,
"HUDDERSFIELD.   It is the intention of the Chartists of this district to invite T. Duncombe, and F. O Connor, Esqs,, to a public soiree, to beheld during the next month.",,Huddersfield,53.6467031,-1.7832077,7,Northern Star,19/11/1842,Meeting,,,
"STALYBRIDGE.   A discussion will take place between Mr. James Leach, Chartist lecturer, and Mr. John Watts, Social lecturer, on the relative merits of Chartism and Socialism, in the People s School, Brierley s-streefc, on Monday, the 28th, and on Tuesday, the 29th instant. Twopence admission.",,Stalybridge,53.4840214,-2.0562536,7,Northern Star,19/11/1842,Meeting,,,
"SHEFFIELD.   Fig Tree Lane.   The weekly harmonic meeting in aid of the Defence Fund, will be held this evening, commencing at half-past seven o clock.",,Sheffield,53.3840547,-1.4683069,7,Northern Star,19/11/1842,Meeting,,,
"SOWERBY.   On the 26th of December there will be a ball holden at this place, the proceeds to go towards the Chartist cause. Tickets, males, threepence each ; and females, twopence each, the Number of tickets will be limited, so that an early application will be necessary. The amusements of the evening will commence at five o clock.",,Sowerby,53.7055036,-1.9324388,7,Northern Star,10/12/1842,Meeting,,,
"MILNROW.   Mr. Joseph Wood, from Rochdale, will preach a sermon in the Chartist Association Room, Milnrow.",,Milnrow,53.6082511,-2.1099476,7,Northern Star,10/12/1842,Meeting,,,
"Delegate Meeting.   A District Delegate Meeting or the Huddersfield District will be held at Dalton, on Sunday, (to-morrow,) at one o clock precisely.",,Dalton,53.651312,-1.7449523,7,Northern Star,10/12/1842,Meeting,,,
"THURSTONLAND.   A lecture will be delivered in the Democratic Chapel, Thurstonland, on Sunday, Dec 18, at six o clock in the evening, by a friend to justice and an hater of oppression. All classes are invited.",,Thurstonland,53.5899953,-1.7509898,7,Northern Star,10/12/1842,Meeting,,,
