Item Type Metadata:NewspaperText,Item Type Metadata:Date of meeting,Item Type Metadata:Place,geolocation:latitude,geolocation:longitude,geolocation:zoom_level,Item Type Metadata:Newspaper,Dublin Core:Date,itemType,geolocation:map_type,geolocation:address,Item Type Metadata:meeting date"BIRMINGHAM.   Delegate Meeting.  All towns in Warwick and Worcestershire are requested to send delegates to the next meeting, which will be held at the Chartist Room, Ashton-street, on Sunday, March the 20th, at two o clock, as the final business connected with the Convention and National Petition will be then transacted. Letters wont do.",,Birmingham,52.4813679,-1.8980726,7,Northern Star,12/03/1842,Meeting,,,
"Delegate Meeting.   An East and North Riding Meeting will be held at the Temperance Hotel, Selby, on Sunday, the 20th instant, at half-past ten o clock, in the forenoon ; those places that do not send delegates must send their opinions by letter.

Cleckheaton Mr. Jennings will lecture here on Monday, March tho 14th; on Tuesday, the 15th, at Birstal ; on Wednesday, the 16th, at Littletown ; and on the following days at the surrounding villages. Each evening at eight o olock.",,Selby,53.781789,-1.070309,7,Northern Star,12/03/1842,Meeting,,,
"Mr. Thomas Ibbotson, local lecturer, Bradford, will lecture at the following places in the ensuing week : Huddersfield, March 14th; Honley, the 15th ; Holmfirth, the 16th ; Almondbury, the 17th ; Lepton, the 18th; and Kirkheaton, the 19th.
",,Mr,,,7,Northern Star,12/03/1842,Tour,,,
"IDLE.   Mr. Candy lectures on Monday, at seven o olock in the evening.",,Idle,53.8352205,-1.7304012,7,Northern Star,12/03/1842,Meeting,,,
"BINGLEY.   Mr. Candy lectures on Tuesday, at eight o clook in the evening, in the Forrester s Court.",,Bingley,53.8436535,-1.824621,7,Northern Star,12/03/1842,Meeting,,,
"
HOLLINWOOD. - A tea party will be held on Easter Monday, in the Chartist room, Ralph Green. Tea on the table at six o'clock.",,Hollinwood,53.5182362,-2.1418375,7,Northern Star,19/03/1842,Meeting,,,
"NORTH LANCASHIRE. - Mr. Lund's ioute :-Monday, March 21st, at Blackburn; Tuesday, the 22nd, Harwood ; Wednesday, the 23rd, at Clithero ; Thursday, the 24th, at Barnoldswick; Friday, the 25th, at Sabden ; Saturday, the 26th, at Preston ; Monday, the 28th, at Kendal ; Tuesday, the 29th, at Chorley ; Wednesday,the 30th, at Burnley; Thursday, the 31st, at Colne; Friday, April lst, at Bacup; and on Saturday, the 2nd, at Todmorden.",,North Lancashire,,,7,Northern Star,19/03/1842,Tour,,,
"YEW GREEN.   A concert and ball will be held on Easter Tuesday,",,Yew Green,53.6348073,-1.8028522,7,Northern Star,19/03/1842,Meeting,,,
"STROUDWATER.   A county meeting n ill be held on Rodborough Hill, near Stroud,on Good Friday, to elect the delegates to the forthcoming Convention. Feargus O Couuor, Esq., and Mr, Henry Vincent are invited to attend the meeting.",,Stroudwater,51.8197745,-2.0037975,7,Northern Star,19/03/1842,Meeting,,,
"WILSDEN.   Mr. Arran preaches on Easter Sunday, afternoon and evening,",,Wilsden,53.8239275,-1.8634375,7,Northern Star,19/03/1842,Meeting,,,
"STAFFORDSHIRE DELEGATE MEETING.   A meeting of delegates from the various towns in Staffordshire will bo held at Mr. Mogg s, Temperance Coffee House, Snow-hill, Wolverhampton, on Sunday, the 27th of March, when the business connected with the forthcoming Convention will be finally settled.",,Birmingham Delegate Meeting,52.4813679,-1.8980726,7,Northern Star,19/03/1842,Meeting,,,
"WORCESTER.   A ball will bo held in the Hall of Science, on Easter Tuesday, the proceeds to go towards supporting the Convention.",,Worcester,52.1918287,-2.2216009,7,Northern Star,19/03/1842,Meeting,,,
"KEIGHLEY. - Chartist Sermons. Tomorrow, Sunday, the 20th instant, two sermons will be delivered in the Working Man s Hall, Sun-street, Keighley, by Mr. Candy, of Wolverhampton; to commence in the afternoon at two o clock, and five in the evening. Collections will be made for the benefit of the forthcoming Chartist Convention.",,Keighley,53.8684021,-1.9020456,7,Northern Star,19/03/1842,Meeting,,,
"BRADFORD.   On Sunday, March 20th, Mr. Henry Hodgson, Mr. AiuLy, and Mr. Borrows will lecture in the large room, Butterworth Buildings, at six o clock in the evening.",,Bradford,53.7941567,-1.7494778,7,Northern Star,19/03/1842,Meeting,,,
"PRESTON.   A public meeting is to be held in Chadwick s Orchard on the 26th instant, to take into consideration the alarming distress of the country, and to elect deputies to the Petition Convention, intended to be holden in London on the 12th of April next.",,Preston,53.7589938,-2.7051618,7,Northern Star,19/03/1842,Meeting,,,
"Mr. John West, the East and North Riding Lecturer, will visit the following places during next week, namely Monday, at York ; Tuesday, at Malton ; Wednesday, at Scarborough; Thursday, at Bridlington ; Saturday, at Beverley; and on Monday, the 28th, at Hull.",,Mr,,,7,Northern Star,19/03/1842,Tour,,,
"General Convention.   The Teetotal locality of Chartists, meeting at Westbrook s Coffee House, Waterloo-road, intend getting up a tea party and concert, to take place on Monday, April 11th 1842, to assist in defraying the expenses of the forthcom-ing Convention. In order to ensure a good attend-ance the price of tickets will be as low as one shilling. The members of the Convention who may have arrived in town are respectfully invited.",,General Convention,51.5023546,-0.1101031,7,Northern Star,19/03/1842,Meeting,,,
"GLOBE FIELDS.   Messrs. Johns and Illingworth will address the Chartists of the Hit-or-Miss, West-street, on Sin day evening next, at eight o clock. Institute.  Mr. R. Cameron will lecture in the Hall or the Institute, 55, Old Bailey, on Sunday, the 20th instant.",,Globe Fields,51.523287,-0.054737,7,Northern Star,19/03/1842,Meeting,,,
"NEW ROAD.   Ruffy Ridley will lecture at the Archery Rooms, Bath-place, New-road. Subject  "" The Evils of Machinery under our present System of Class Legislation,  To commence at seven o'clock.",,New Road,51.5232372,-0.1377315,7,Northern Star,19/03/1842,Meeting,,,
"BRIDE LANE.   All persons desirous of enrolling themselves as Members of the London Chartist Lecturing Committee are requested to meet at the Dispatch Coffee Rooms, Bride-lane, on Friday, the 25th instant, at eight o clock, to arrange a plan for mmre effectually supplying the rapidly increasing Metropolitan Localities with suitable lecturers. The attendance of alt favourable to thisobjeot is requested.",,Bride Lane,51.513914,-0.105093,7,Northern Star,19/03/1842,Meeting,,,
"SOUTHWARK, BRIDGE ROAD.   A general meeting of the Chartist hatters will be held at their room, Brown Bear, on Wednesday, the 23rd instant, at eight o clock.",,"Southwark, Bridge Road",51.506094,-0.0957052,7,Northern Star,19/03/1842,Meeting,,,
"HONLEY.   A delegate meeting will be held in the Chartist Association Room, on Sunday, the 20th inst. at one o clock in the afternoon. Delegates from the Huddersfield Poor Law Union are expected.",,Honley,53.6022372,-1.7891409,7,Northern Star,19/03/1842,Meeting,,,
"ASHTON-UNDER-LYNE.   Mr. Booth, from Newton Heath, will lecture to-morrow, at six o clock in the evening.",,Ashton-under-lyne,53.4854941,-2.1120849,7,Northern Star,19/03/1842,Meeting,,,
"HEYWOOD.   A ball is to come off on Good Friday, on behalf of the Manchester maimed and wounded.",,Heywood,53.5858251,-2.2339204,7,Northern Star,19/03/1842,Meeting,,,
"ELLAND-UPPER-EDGE.   Mr. William North, of Norwood Green, will deliver a lecture in the large room, Black Bull Inn, on Saturday, the 26th inst. at half-past seven o'clock in the evening.",,Elland-upper-edge,53.6840387,-1.8162621,7,Northern Star,19/03/1842,Meeting,,,
"Mr Candy s Route for the next Fortnight.   Skipton, on Saturday, the 19th of March; at Keighley on Sunday, the 20th; Shaw (near Haworth), on Monday, the 21st; Ke^nley, Tuesday, the 22nd; Allerton, Wednesday, the 23rd; Clayton, Thursday, the 24th; Thornton, Saturday, the 26th; Bingley, Sunday, the 27th; Morton, Monday, the 28th; Cul-lingworth (public meeting), on Tuesday, the 29th; Baildon, Wednesday, the 30th : Shipley, Thursday, the 3lst; and Wilsden, on Monday, the 4th of April.	
",,Mr Candy S Route For The Next Fortnight,,,7,Northern Star,19/03/1842,Tour,,,
"SOWERBY.   There will be a ball holden in the Chartist Room, on Easter Tuesday, the proceeds to go towards establishing a school for the education of the adult and rising generation.",,Sowerby,53.7055036,-1.9324388,7,Northern Star,26/03/1842,Meeting,,,
"Mr. Martin will lecture at the Greyhound, Peckham, on Wednesday, the 30th inst., at eight o clock in the evening.",,Greyhound,51.4741063,-0.0684908,7,Northern Star,26/03/1842,Meeting,,,
"HALIFAX.   The Chartists of this place will have a public tea on Easter Tuesday, in the Charter Institution. Tea on the table at four o clock. After tea recitations, singing, and other entertainments will ocoupy the remainder of the evening. Admission to tea, &c, 9d; after tea, 3d.",,Halifax,53.725,-1.863,7,Northern Star,26/03/1842,Meeting,,,
"Mr. Candy s Route.   Mr. Candy will lecture at Thornton, on Saturday, the 26th of March ; Morton, Monday, the 28th ; Cullingworth, (public meeting,); Tuesday, the 23th ; Baildon, Wednesday, the 30th; Shipley, Thursday, the 31st; and at Wilsden, on Monday, April 4th.",,Mr,,,7,Northern Star,26/03/1842,Tour,,,
"BINGLEY.   The next Delegate Meeting will be held in the Foresters  Court, on Sunday, the 3rd of April, at ten o clock in the forenoon. It is requested that Guiseley, Baildon, Shipley, and Clayton will send delegates.",,Bingley,53.8436535,-1.824621,7,Northern Star,26/03/1842,Meeting,,,
"MACCLESFIELD.   A meeting of delegates for the County of Chester will be held in the Association Room, Waterloo, on Sunday, the 3rd of April, when each delegate must be prepared with sufficient power to carry into effect the whole business of the Convention, in respect to the funds and petition. Those places who cannot send a delegate must send a letter, with their amount of funds enclosed.",,Macclesfield,53.2606635,-2.1255158,7,Northern Star,26/03/1842,Meeting,,,
"A Tea Party will take place at the Chartist Association Room on Easter Monday, the proceeds to go to the Convention.",,Macclesfield,53.2606635,-2.1255158,7,Northern Star,26/03/1842,Meeting,,,
"BIRMINGHAM.   Public Dinner to Feargus O Connor, Esq.   It is the intention of the members of the National Charter Association of this town, to honour this tried friend of the people with a public dinner in the course of a week.",,Birmingham,52.4813679,-1.8980726,7,Northern Star,26/03/1842,Meeting,,,
"A North Lancashire Delegate Meeting will be held at Accrington, on Sunday, April 3rd, to commence precisely at one o clock. The sub-treasurers are requested to send the amount of money levied for the Convention, by their respective delegates. Those places that cannot send delegates, are requested to send letters, stating who they are desirous of engaging as district Lecturer for the next six weeks, Mr. Lund s term having expired.",,Accrington,53.7541156,-2.3655434,7,Northern Star,26/03/1842,Meeting,,,
"HALIFAX.   A public meeting will be held in the Charter Association Room, Swan Coppice, on Monday, March 28th, at two o clock in the afternoon, for confirming the election of delegates to the Petition Convention.",,Halifax,53.725,-1.863,7,Northern Star,26/03/1842,Meeting,,,
"Mr. John West, the East and North Riding lecturer, will visit the following places during the next week, viz. Monday, at Hull ; Wednesday, at Doncaster ; Thursday, at Selby; Friday, at Pocklington ; Saturday, at Stamford Bridge ; Sunday, at York; and on Monday, the 4th of April, at Malton.",,Mr,,,7,Northern Star,26/03/1842,Tour,,,
"Mr. Jones, the late lecturer for the North and East Riding, is particularly requested to be in Halifax at twelve o clock on Monday, the 23th of March. Business of importance requires his attendance.",,Halifax,53.725,-1.863,7,Northern Star,26/03/1842,Meeting,,,
"HUNSLET.   Messrs. Longstaff and Butler will lecture here to-morrow, at half-past six o clock in the evening.",,Hunslet,53.7834388,-1.5359315,7,Northern Star,26/03/1842,Meeting,,,
"Mr. Anderson will lecture at the Carpenters  Arms, Brick-lane, on Sunday, the 17th.",,Carpenters Arms,51.5239026,-0.0673992,7,Northern Star,16/04/1842,Meeting,,,
"Mr. Rouse will lecture at the Buck s Head. Shoreditch, on Sunday, April 17th.",,Shoreditch,51.5249983,-0.0701544,7,Northern Star,16/04/1842,Meeting,,,
"SHOEMAKERS.   Mr. Brannan (from the Isle of Wight) will lecture at the Clock House, Castle-street, Leicester-square, on Sunday, the 17th.",,Shoemakers,51.5101773,-0.1302418,7,Northern Star,16/04/1842,Meeting,,,
"Shoemakers   Mr. Southie will lecture at the Crown and Anchor, Waterloo Town on Sunday, the 17th.",,Shoemakers Mr,51.5236249,-0.0698263,7,Northern Star,16/04/1842,Meeting,,,
"CAMBERWELL.   Mr. Rouse will lecture here on Wednesday, the 20th of April.",,Camberwell,,,7,Northern Star,16/04/1842,Meeting,,,
"Shoemakers.   Mr. Farrar will lecture at the Star Coffee House, Golden Lane, on Sunday, the 17th of April.",,Shoemakers,51.5213731,-0.0942386,7,Northern Star,16/04/1842,Meeting,,,
"55, OLD BAILEY.   Mr. Mee will lecture on Sunday, at the Political Institute, at 7 o'clock precisely.",,"55, Old Bailey",51.5146069,-0.1023808,7,Northern Star,16/04/1842,Meeting,,,
"THREE CROWNS, RICHMOND STREET. - The tailors connected with this locality are requested to attend at the above house on Sunday, April 24th, at eight o clock, to elect a Secretary, and transact other important business.",,"Three Crowns, Richmond Street",51.511651,-0.133876,7,Northern Star,16/04/1842,Meeting,,,
"WEST RIDING.   A West Riding delegate meeting will be hold at Dewsbury, on Sunday, (to-morrow,) at eleven o clock, in the large room over the Cooperative Stores, on business of importance relative to the People s Convention, and the re-organization of the West Riding.",,West Riding,53.75,-1.666667,7,Northern Star,16/04/1842,Meeting,,,
"Mr. E. P. Mead will lecture at Bilston on Monday, the 18th inst., at Darleston, on the 19th ; at Wolverhampton, on the 20th; at Walsall on the 21st.",,Mr,,,7,Northern Star,16/04/1842,Tour,,,
"On Sunday, the 17th inst., Mr. E. P. Mead will preach at Duddeston Row, Birmingham, at three o clock in the afternoon.",,Birmingham,52.4813679,-1.8980726,7,Northern Star,16/04/1842,Meeting,,,
"QUEENSHEAD.   Mr. Bell, from Heywood, will lecture at Queenshead, on the 21st inst. Subject  "" What will be the best laws to be enacted after the Charter has become the law of the land, in order to produce happiness ami prosperity to the nation ? ",,Queenshead,,,7,Northern Star,16/04/1842,Meeting,,,
"SALFORD JUVENILE CHARTISTS, GREAT GEORGE'S STREET.   Mr. Robert Roberts lectures on the 27th inst., and Mr. Elliott Buckley, on the 4th May.",,Salford,53.4877463,-2.2891921,7,Northern Star,16/04/1842,Meeting,,,
"OLDHAM.   On Sunday, (to-morrow), Mr. James Cartledge will lecture at Waterhead Mill, at two o clock in the afternoon, and in Oldham at six in tho evening. Also, on Monday, a discussion will take place in the Chartist room, Greaves-street, Oldham. Subject,   The most effectual means of obtaining the People s Charter.  Discussion will commence at nine o olock in the evening.",,Oldham,53.5415797,-2.1147831,7,Northern Star,16/04/1842,Meeting,,,
"An East and North Riding Delegate Meeting will be held at Selby, on Sunday, May 1st, at half past ten o clock in the forenoon, when it is requested that all places that can, will send delegates, as business of the greatest importance will bo brought forward. Those places that cannot send delegates must forward their opinions by letter, and every particular of their various localities.",,"An East And North Riding Delegate Meeting Will Be Held At Selby, On Sunday, May 1st, At Half Past Ten O Olook In The Forenoon, When It Is Requested That All Places That Can, Will Send Delegates, As Business Of The Greatest Importance Will Bo Brought Forward",53.781789,-1.070309,7,Northern Star,16/04/1842,Meeting,,,
"Mr. West s Route - Cleckheaton, Tuesday, the 19th; Birstal, Wednesday, the 20th; Batley, Thursday, the 21st; Poiovens, Friday, the 22nd; Horbury, Saturday, the 23d ; Dewsbury, Sunday, the 24th; Heckmondwike, Monday, the 25th ; Littletown, Tuesday, the 26th ; Dewsbury, Wednesday, the 27th, in the Market Plaoe; Ossett, Thursday, the 23ih; Earlsheaton, Friday, the 29th ; Wakefield, Saturday, the 30th.",,Mr,,,7,Northern Star,16/04/1842,Tour,,,
"LOUGHBOROUGH.   On Sunday, April 24th, a delegate meeting for the Northern division of Leicestershire, will be held in the Association Room, Loughborough, at half-past two p.m. to devise means for the better organization of the district.",,Loughborough,52.7723859,-1.2077985,7,Northern Star,16/04/1842,Meeting,,,
"ROCHDALE.   Mr. Jones, of Liverpool, will lecture here on Sunday, (to-morrow), at half-past two and at six in the evening.",,Rochdale,53.6153659,-2.1557561,7,Northern Star,16/04/1842,Meeting,,,
"Mr. Stringlehurst will lecture at Congleton, 17th April ; Potteries, 18th and 19th ; Stafford, 20th ; Wolverhampton, 21st; Bilston, 22nd ; Birmingham, 23rd, if the parties can make it convenient.",,Mr,,,7,Northern Star,16/04/1842,Tour,,,
"Delegate Meeting.   A meeting of delegates from the various districts in the West Riding, will be held at the house of Mr. Carrodus, the North Tavern, Bradford, on Sunday, the 1st of May, at ten o clock in the forenoon. It is particularly requested that each district will appoint a delegate.",,Bradford,53.7941567,-1.7494778,7,Northern Star,23/04/1842,Meeting,,,
"LONDON.   A grand gala and ball will take place at the Royal Albert Saloon, Shepherdess Walk, City Road, on Thursday, the 12th May, for the benefit of Mr. Lunt, an old stager in the cause of democracy. The whole to conclude with a splendid drama.  Tickets 9d.; reserved seats, 1s.; ball room, 1s.",,London,51.5283699,-0.0916379,7,Northern Star,23/04/1842,Meeting,,,
"An East and North Riding Delegate Meeting will be held at the Temperance Hotel, Selby, on Sunday, the 1st of May, when it is hoped a goodly number of delegates will be present.",,"An East And North Riding Delegate Meeting Will Be Held At The Temperance Hotel, Selby, On Sunday, The 1st Of May, When It Is Hoped A Goodly Number Of Delegates Will Be Present",53.781789,-1.070309,7,Northern Star,23/04/1842,Meeting,,,
"DEWSBURY.   Mr. West will deliver a lecture on Sunday, April 24th, in the large room, over the Cooperative Stores, at six o clock in the evening. He will also deliver a lecture at the Market Cross, on Wednesday, April 27th, at half-past seven o clock in the evening.",,Dewsbury,53.6909103,-1.6302142,7,Northern Star,23/04/1842,Meeting,,,
"LONG WHATTON.   Mr. Pepper of Normanton, will lecture here on Sunday, May 1st, in the forenoon and afternoon.	",,Long Whatton,52.8072056,-1.2912986,7,Northern Star,23/04/1842,Meeting,,,
"MACCLESFIELD.   A delegate meeting will take place in the Association Rooms, Watercotes, on Sunday, the 1st of May. The County Secretary must at the same time inform the different Associations that a county lecturer cannot be engaged until the next delegate meeting, as the whole of the Convention and Lecturers  Fund is not brought up.
",,Macclesfield,53.2606635,-2.1255158,7,Northern Star,23/04/1842,Meeting,,,
"IDLE.   Messrs. Dewhirst and Edwards will lecture here on Whit-Monday evening, at eight o clock.",,Idle,53.8352205,-1.7304012,7,Northern Star,14/05/1842,Meeting,,,
"NEW MILLS.   On Whit-Monday, a public meeting will be held in Cavendish-square, when Mr. Doyle, and Mr. Leach, of Hyde, wiil attend, and address the people. The men of Compstallbridge, Mill Brow, Mellor, Marple, Disley, Whaley, &c. are invited to attend.",,New Mills,53.3853154,-1.9899535,7,Northern Star,14/05/1842,Meeting,,,
"STALYBRIDGE.   Mr. John Durham leotures here to-morrow, at six in the evening.",,Stalybridge,53.4840214,-2.0562536,7,Northern Star,14/05/1842,Meeting,,,
"BIRMINGHAM.   A public dinner will be held at the Black Horse inn, Prospect Row, Birmingham, on Tuesday, May 17th, in honour of Feargus O Connor, Esq. Mr, O Connor will attend on the ocoasion.",,Birmingham,52.4813679,-1.8980726,7,Northern Star,14/05/1842,Meeting,,,
REDDITCH.   Mr. White will address the men of Redditch on Whit-Monday.,,Redditch,52.3058903,-1.9417311,7,Northern Star,14/05/1842,Meeting,,,
"A Ball and Concert in aid of the funds of the West End Chartist Association of Boot-makers, will take place on Whit-Tuesday, at the Clock House, Castle-street, Leicester-square. Single Tickets, 6d.; Double Tickets, 9d. To commence at Eight o clock. Dr. M'Douall will preside.",,"A Ball And Concert In Aid Of The Funds Of The West End Chartist Association Of Boot-makers, Will Take Place On Whit-tuesday, At The Clock House, Castle-street, Leicester-square",51.5101773,-0.1302418,7,Northern Star,14/05/1842,Meeting,,,
"WALWORTH.   A Concert, Festival, and Ball will be held on Whit-Monday, at the Montpelier Tavern, in aid of the funds for the late Demonstration. Dr. McDouall and other advocates of the people s rights will attend. Tickets, as usual. Tea to commence at half-past five o clock.",,Walworth,51.484797,-0.096458,7,Northern Star,14/05/1842,Meeting,,,
"MACCLESFIELD.   A delegate meeting will assemble in the Chartist Association rooms, Watercoates, on Sunday, the 29th instant. Each delegate is requested, if the Association from which he comes is in arrear to the Convention and Lecturer s Funds, to bring forward the same.",,Macclesfield,53.2606635,-2.1255158,7,Northern Star,14/05/1842,Meeting,,,
HECKMONDWIKE.   Mr. West will lecture here on Whit-Monday; and on Whit-Tuesday at Earleheaton.,,Heckmondwike,53.7074371,-1.6754499,7,Northern Star,14/05/1842,Meeting,,,
"HALIFAX.   On Whit-Monday there will be a lecture delivered in the Chartist Lecture Room, Swan Coppice, by Mr. Wallace, to commence at six o clock, after which there will be a ball and other entertainments. Admittance threepence each, for the 
  
benefit of the funds of the Association.",,Halifax,53.725,-1.863,7,Northern Star,14/05/1842,Meeting,,,
"A Delegate Meeting of this district will be held in the Charter Association Room, Ludenden, on Sunday, May 15th, at two o clock in the afternoon.",,Luddenden,53.7309797,-1.937331,7,Northern Star,14/05/1842,Meeting,,,
"Lecture.   A lecture will be delivered next Sunday, at the Carpenters  Arms, Brick Lane.",,Lecture,51.5239026,-0.0673992,7,Northern Star,14/05/1842,Meeting,,,
"BRADFORD.   A public meeting, called by requisition, will be held in front of the Odd Fellows  Hall, on Whit-Tuesday, at six o clock. Mr. O Connor, Mr. Pitketbly, and Mr. West have been invited to attend.",,Bradford,53.7941567,-1.7494778,7,Northern Star,14/05/1842,Meeting,,,
"NEWTON HEATH.   The Chartists of this place intend to have a tea party on Whitsun-Friday, at six o clock in the evening. Ladies  tickets, 6d.; Gentlemen's, 9d.; and may be had of the following persons;  Mr. John Ward, Great Newton-street; Mr. Joseph Bates, shopkeeper, Newton ; Mr. Edward Worrall, Upfield, Fails worth; Mr. Joseph Fletcher, Oldhara-road, Newton; Mr. Thos, Pollitt, Church-street, Newton; Mr, Davis Booth, Botany Bay, Newton.",,Newton Heath,53.1924965,-2.4506619,7,Northern Star,14/05/1842,Meeting,,,
"Mr. Doyle will visit the following places on the following days - Campsall Bridge, on Saturday, the 14th; Hazlegrove, on Sunday, the 15th, at six o'clock in the evening ; and at new Mills, on Monday, the 16th, at eight o clock in the eveniug. Mr. Doyle is now residing in Manchester ; and those places desirous of obtaining his services, would oblige him by addressing their communications, No. 3, Price-street, Every-street, Manchester.",,Mr,,,7,Northern Star,14/05/1842,Tour,,,
"MACCLESFIELD.   A County Delegate Meeting will assemble in the Chartist Association Rooms, in the Watercotes, on Sunday, the 29th inst., and it is hoped that no locality will fail sending a member, as important business will be brought before them, which must be settled, and all the different localities are required to take particular notice of the appeal of the finance committee in the Star of last Saturday, and see to their accounts being settled immediately.",,Macclesfield,53.2606635,-2.1255158,7,Northern Star,21/05/1842,Meeting,,,
"HEYWOOD.   Mr. M. Roberts will lecture in the Association Room, Hartley-St., on Sunday, (to-morrow) at six o'clock in the evening.",,Heywood,53.5858251,-2.2339204,7,Northern Star,21/05/1842,Meeting,,,
"BRADFORD.   Mason's Arms.  A lecture will be delivered by Mr. George Felix, this evening, subject ""The Repeal of the Union. ",,Bradford,53.7941567,-1.7494778,7,Northern Star,21/05/1842,Meeting,,,
"The Chartists of Hollingworth intend having a tea party this day, 21st of May, at six o'clock in the evening, at the New Inn. Mr. D. Dumvan, from Manchester, is expected to address the company, and he will lecture at the Association Room on Sunday, the 22nd, at half-two.",,Hollingworth,53.4634966,-1.9926971,7,Northern Star,21/05/1842,Meeting,,,
"DEWSBURY.   On Sunday, (to-morrow,) Mr. M. North will preach two sermons in the large room over the Co-operative Stores, for the benefit of C. Wood, now confiued in Rothwell Gaol, for another man's feats, and unable to raise the money to file his petition. Service to commence at half-past two o'clock in the afternoon, and six o'clock in the evening.",,Dewsbury,53.6909103,-1.6302142,7,Northern Star,21/05/1842,Meeting,,,
"Mr. Brophy will lecture at Newark on Monday, the 23rd, and Tuesday, the 24th instant; at Gainsborough on Wednesday, the 25sh ; and at Hull on Thursday, the 2oth.",,Mr,,,7,Northern Star,21/05/1842,Tour,,,
