Item Type Metadata:NewspaperText,Item Type Metadata:Date of meeting,Item Type Metadata:Place,geolocation:latitude,geolocation:longitude,geolocation:zoom_level,Item Type Metadata:Newspaper,Dublin Core:Date,itemType,geolocation:map_type,geolocation:address,Item Type Metadata:meeting date"1, CHINA WALK, LAMBETH.   The shareholders of the above place are earnestly requested to attend a meeting, on Monday, May 23, at Eight o'clock pre-cisely, on business of great importance.
",,"1, China Walk, Lambeth",51.495397,-0.1126751,51.495397,-0.1126751,21/05/1842,Meeting,,,
"DEWSBURY.   Mr. O Connor will lecture at Dewsbury on Friday, June 3rd, The chair to be taken at eight o clock in the evening.",,Dewsbury,53.6909103,-1.6302142,7,Northern Star,28/05/1842,Meeting,,,
"Mr. West s Route for the ensuing Week.   On Monday, May 30th, at Cleckheaton ; Tuesday, May 31st, at Wakefield ; Wednesday, June 1st, at Dewsbury ; Thursday, June 2nd, at East Ardsley ; Friday, June 3rd, at Ossett; and Saturday, June 4th. at West Ardsley.",,Mr,,,7,Northern Star,28/05/1842,Tour,,,
"REGENT STREET.   Mr. Fussell will lecture to the Teetotallers, at the Crown Coffee House, Beak-street.",,Regent Street,51.512627,-0.137514,7,Northern Star,28/05/1842,Meeting,,,
"Mr. John Watkins will lecture at the Working Man s Hall, No. 5, Circus-street, New Road, on um/ay next, at half-past seven.",,Working man's hall,51.5203722,-0.16248,7,Northern Star,28/05/1842,Meeting,,,
"BURY.   Mr. James Leach of Manchester, will lecture here on Monday, the 30th, in the Garden-street leoture room, at eight o clock in the evening.",,Bury,53.593,-2.298,7,Northern Star,28/05/1842,Meeting,,,
"Mr. Brophy will lecture at Sutton-in-Ashfield on Wednesday, June 1st; and at Mansfield on Thursday, June 2nd.",,Mr,,,7,Northern Star,28/05/1842,Tour,,,
"WINCHCOMBE.   An out-door meeting will take place at Winchcombe, on Monday, the 30th instant, at seven o clock in the evening ; and at Toddington, on Sunday, the 5th of June, at three o olock in the afternoon.",,Winchcombe,52.6351482,1.2608417,7,Northern Star,28/05/1842,Meeting,,,
"STOURBRIDGE.   A Chartist tea party will take place on Monday, June; 6th. Tickets may be had from Mr. Goodfellow, Stourbridge, Mr. Freeman, Hay-green, Mr. Cbanoe, Old Swinford; and Mr. Welch, Lye-waste.",,Stourbridge,52.4577615,-2.1474345,7,Northern Star,28/05/1842,Meeting,,,
"ASHTON.   Mr. Bayley, of Manchester, will lecture in the National Charter Association, on Sunday, (tomorrow) at six o clock in the evening.",,Ashton,53.4911289,-2.0937689,7,Northern Star,28/05/1842,Meeting,,,
"STROUD.   A special meeting will be held on Monday, when the members and friends of democracy are earnestly entreated to attend.",,Stroud,51.745424,-2.2198605,7,Northern Star,28/05/1842,Meeting,,,
"Mr. Brophy will lecture at Sutton-in-Ashfield, on Wednesday, the 1st of June; Mansfield, 2nd; Chesterfield, 3rd; Sheffield, 5th; Barnsley, 6th; Wakefield, 7th; Leeds, 8th; Bradford,9th; Bingley, 12th; Halifax, 13th; Todmorden, 14th; Rochdale, 15th ; and Manchester the 16th. All communications for Mr. Brophy to be sent to Mr. G. J. Harney, 11, Hartshead, Sheffield.",,Mr,,,7,Northern Star,28/05/1842,Tour,,,
"Mr. Brophy will be in Macclesfield, on Sunday, the 19th of June.",,Macclesfield,53.2606635,-2.1255158,7,Northern Star,28/05/1842,Meeting,,,
"BINGLEY.   The next delegate meeting of the Bingley district, will be held in the Foresters  Court, York-street, on Sunday, the 5th of June, at nine o clock in the morning.",,Bingley,53.8436535,-1.824621,7,Northern Star,28/05/1842,Meeting,,,
"DOGHOUSE.   Mr. T. B. Smith will preach three sermons here on Sunday, June 5th, in the morning, at ten o clock, on the duties of Christians in reference to the social and political arrangements of society; in the afternoon, at two o clock, on the evils resulting from an indulgence in vicious habits ; and in the evening at six, on the valley of dry bones.",,Doghouse,53.6477074,-1.4878314,7,Northern Star,28/05/1842,Meeting,,,
"LANCASHIRE.   A delegate meeting will he held on Sunday, June 7th, when a balance sheet of the Convention fund will be laid before the delegates. The meeting to take place at ten o clock precisely, in Brownst., Manchester.",,Lancashire,53.86117155,-2.54711144,7,Northern Star,28/05/1842,Meeting,,,
"The South Lancashire delegate meeting will take place on Sunday, in the Association Room, Brown-street, Manchester, at ten o'clock in the forenoon.",,"The South Lancashire Delegate Meeting Will Take Place On Sunday, In The Association Room, Brown-street, Manchester, At Ten O'clock In The Forenoon",53.481074,-2.2424089,7,Northern Star,04/06/1842,Meeting,,,
"Mr. W. S. Ellis will lecture at the following places in the Staffordshire Potteries  Longton, on Monday, June 6th ; Burslem, Red Bull Inn, Tuesday, the 7th ; Hanley, Market Place, Wednesday, the 8th; Stoke, Market Place, Thursday, the 9th ; and Tunstall, Market Place, Friday, the 10th. At seven o'clock in the evening.",,Mr,,,7,Northern Star,04/06/1842,Tour,,,
"MARYLEBONE.   Mr. Ruffy Ridley will lecture at the Working Men's Hall, 5, Circus-street, New-row, Marylebone, on Sunday, June 5th, at half-past seven o'clock.",,Marylebone,51.5203722,-0.16248,7,Northern Star,04/06/1842,Meeting,,,
"George Evans's Route.  Redditch Green, June the 8th ; Studley, the 9th ; and Bridford the 10th.",,George Evans's Route,,,7,Northern Star,04/06/1842,Tour,,,
"DEWSBURY.   The Dewsbury Chartists are required to attend their rooms over the Stores, on Tuesday, the 7th day of June, at eight P. M. to transact important business in connexion with the the Executive.",,Dewsbury,53.6909103,-1.6302142,7,Northern Star,04/06/1842,Meeting,,,
"HONLEY.   A district delegate meeting will be held here on Sunday, the 12th of June, at one o'clock in the afternoon. Those parties having Repeal sheets are requested to hand them in to the District Secretary on that day.",,Honley,53.6022372,-1.7891409,7,Northern Star,04/06/1842,Meeting,,,
"Camp Meeting.   On Sunday, June 12th, a camp meeting will be held on Oldham Edge, to commence at two o'clock in the afternoon, and at six in the evening, Mr. James Leach, Mr. David Ross, Mr. C. Doyle, and Mr. William Bell are expected to attend.	",,Oldham,53.5415797,-2.1147831,7,Northern Star,04/06/1842,Meeting,,,
"KEIGHLEY.   A Chartist Camp Meeting will be held on Moss Carr, Long Lee, near Keighley, on Sunday, to-morrow, at one o'clock in the afternoon. Messrs. Dewhirst and Edwards from Bradford, and other friends, will address the meeting. Mr. Doyle from Manchester is also expected. Mr. Edwards will preach in the Working Man's Hall in the evening, at half-past five o'clock.",,Keighley,53.8684021,-1.9020456,7,Northern Star,04/06/1842,Meeting,,,
"DEWSBURY DISTRICT.   A District Council Meeting will be held at Mr. Benjamin Bromley's, Batley, on Sunday, June 5th at two o'clock in the afternoon. Delegates from the whole of the district are desired to attend.",,Dewsbury District,53.6909103,-1.6302142,7,Northern Star,04/06/1842,Meeting,,,
"DURHAM.   On Monday, June 13th, Mr. Williams will lecture in the Market Place, at seven o'clock in the evening.",,Durham,54.7764152,-1.5758539,7,Northern Star,04/06/1842,Meeting,,,
"Mr. James Duffy lectures at Sheffield, on Monday, June 6th; Chesterfield, on Wednesday, the 8th; Matlock, on Thursday, the 9th ; Belper, on Friday, the 10th ; Sutton- in- Ashfield, on Saturday, the 11th; Mansfield, on Monday, the 13th : and Derby, on Tuesday, tho 14th.	",,Mr,,,7,Northern Star,04/06/1842,Tour,,,
"STAFFORD AND SALOP.   A delegate meeting of the counties of Salop and Stafford. will be held at Newport, Salop, on Sunday, June 19th.",,Stafford And Salop,52.7078083,-2.7509494,7,Northern Star,04/06/1842,Meeting,,,
"SHEFFIELD. - Mr. P. M. Brophy will address the Chartists of Sheffield, on the site of the Old Sugar House, top of Sheffield Moor, on Sunday, June 5th, at half-past two o'clock. N.B. If the weather is unfavourable, the meeting will assemble in the Fig-tree Lane Room.  In the evening Mr. Brophy will deliver a second address in the National Charter Association Room, Fig-tree Lane, at half-post seven o'clock.	",,Sheffield,53.3840547,-1.4683069,7,Northern Star,04/06/1842,Meeting,,,
"BIRSTAL.   Mr. West will preach here on Sunday, at half-past two o'clock.",,Birstal,53.730819,-1.663461,7,Northern Star,04/06/1842,Meeting,,,
"HOLMFIRTH.   Two sermons will be preached in the Association Room, June 5th, at two o clock p.m. by Mr. G. Brook ; and at six o'clock in the evening, by Mr. J. Bray, on behalf of Mr. Christopher Wood, who is suffering in Rothwell gaol, in consequence of having proposed one of the Chartist candidates at the last West Riding election. For so doing he was dismissed from his employment; and tho consequent embarrassment has ended in his being lodged in gaol.",,Holmfirth,53.5703632,-1.7870544,7,Northern Star,04/06/1842,Meeting,,,
"LONDON.   Mr. Farrer will lecture on the Corn Laws, on Sunday, in the Archery Rooms, Bath-place, New-road.",,London,51.5232372,-0.1377315,7,Northern Star,11/06/1842,Meeting,,,
"MR. ROUSE will lecture on Sunday, at the Goldbeaters  Arms, Old St. Pancras-road.",,Mr,51.534999,-0.131596,7,Northern Star,11/06/1842,Meeting,,,
"SHOREDITCH, ALBION COFFEE HOUSE, CHURCH-STREET.   The members of this locality, are requested to attend on Sunday, (to-morrow) as business of importance will require their particular attention.",,"Shoreditch, Albion Coffee House, Church-street",51.5172361,-0.1032761,7,Northern Star,11/06/1842,Meeting,,,
"MOSSLEY.   Isaac Barrow, will preach here, in the Chartist Room, Brookbottom, on Sunday, June 19th, in the afternoon and evening. The evening service will be the funeral sermon of Henry Frost. A collection will be made after each sermon to defray the expences incurred in fitting up and cleaning the the room.",,Mossley,53.5130582,-2.0358291,7,Northern Star,11/06/1842,Meeting,,,
"MR. E. P. MEAD of Birmingham, will visit the Derby Chartists on Monday, the 13th June:  Belper, on Tuesday, and the localities surrounding it, during the week. If they will communicate their arrangements to Mr. Vickers, of Belper, E. P. Mead will visit them all in turn.",,Mr,,,7,Northern Star,11/06/1842,Tour,,,
"MR. WEST'S ROUTE:-On Monday, June 13th, at Batley Carr; Tuesday, Wakefield; Wednesday, Potovens; Thursday, Thornhill Edge; Friday, Hightown; Saturday, Horbury.",,Mr,,,7,Northern Star,11/06/1842,Tour,,,
"NEWHAVEN, NEAR LEITH.   Mr. Tankard will preach in Newhaven next Sunday, and a collection will be made on behalf of Frost, Williams, and Jones.",,"Newhaven, Near Leith",55.982355,-3.194087,7,Northern Star,11/06/1842,Meeting,,,
"HALIFAX.   The next monthly delegate meeting of this district will be held in the Chartist Association Room, Lower Warley, on Tuesday, June 12th, at two o clock in the afternoon.",,Halifax,53.725,-1.863,7,Northern Star,11/06/1842,Meeting,,,
"BARNSLEY.   A public meeting will be held in the School Room, under the Odd Fellows  Hall, where business of importance will be transacted.",,Barnsley,53.5527719,-1.4827755,7,Northern Star,11/06/1842,Meeting,,,
"MR. BROPHY, of Dublin, will lecture in the Association Room, Yorkshire-street, on Wednesday, the 15th inst., the chair to be taken at eight o clock.",,Rochdale,53.6153659,-2.1557561,7,Northern Star,11/06/1842,Meeting,,,
"SALOP AND STAFFORD.   A delegate meeting of the above counties will take place at Newport, Salop, on Sunday, June l9th. All Associations in the two counties are requested to send delegates, as business of importance will be brought before them connected with the appointment of a lecturer, &c. The delegates, on arriving, will inquire for Mr. Frederick Macklin, hair-dresser, who will conduct them to the place of meeting.",,Salop And Stafford,52.7078083,-2.7509494,7,Northern Star,11/06/1842,Meeting,,,
"HONLEY.   A district delegate meeting will be held at Honley on Sunday, (to-morrow,) chair to be taken at one o clock, when those parties holding petition sheets for the Repeal of the Legislative Union are requested to hand them in to the district Secretary immediately. After the business is concluded a lecture will be delivered in the Association Room by Mr. Edward Clayton, chair to be taken at six o clock. Discussion invited.",,Honley,53.6022372,-1.7891409,7,Northern Star,11/06/1842,Meeting,,,
"SOUTH LANCASHIRE. - MR. BELL'S ROUTE.   At Leigh, on Monday, June 13th; Ashton-le-Willows, on the 14th; Newton-le-Willows, on the 15th; Warrington, on the 16th; St, Helen's, on the 17th; Prescot, on the 18th; Liverpool, on the 19th; Ormskirk, on the 20th; Uphalland on the 21st; Wigan, on the 22nd; Hindley, on the 23rd; and West Houghton, on the 24th.",,South Lancashire,53.481074,-2.2424089,7,Northern Star,11/06/1842,Tour,,,
"HOLBECK AND ARMLEY.   Mr. T. B. Smith will preach at Holbeck in the afternoon at two o clock, and at Armley at six o clock on Sunday, June 19. The friends at each place are requested to make the sary arrangements.",,Holbeck And Armley,53.797533,-1.574603,7,Northern Star,11/06/1842,Meeting,,,
"Crown Coffee House.-Mr. Ridley will lecture here on Sunday, at nine o'clock precisely.",,Crown Coffee House,51.512627,-0.137514,7,Northern Star,18/06/1842,Meeting,,,
"Marylebone.-Dr. P. M, M'ouall will lecture at the Working Men's Hall, 5, Circus*street, New Road, Marylebone, on Sunday, at half-past seven o clock.",,Marylebone,51.5203722,-0.16248,7,Northern Star,18/06/1842,Meeting,,,
"Rochdale.-Mr. John Bailey, of Manchester, will lecture here on Sunday, in the Chartist Room, at half-past two, and six in the evening.",,Rochdale,53.6153659,-2.1557561,7,Northern Star,18/06/1842,Meeting,,,
"A Chartist Camp Meeting will be held on Sunday, the 26th inst., on Calderbrook Moor, to commence at half-past two in the afternoon.",,Calderbrook Moor,,,7,Northern Star,18/06/1842,Meeting,,,
"Wortley.- A camp meeting will be held on Wortley Moor, at two o'clook on Sunday, when Messrs Frazer, Dixon, Longstaff, and Beaumont will address the meeting. A sermon will also be preached in the Association Room the same evening, at half-past five o'clock.",,Wortley,53.7905874,-1.605919,7,Northern Star,18/06/1842,Meeting,,,
"Leeds.-An adjourned meeting of the Association will be held this evening, (Saturday,) at nine o'clock, in the room.",,Leeds,53.7974185,-1.5437941,7,Northern Star,18/06/1842,Meeting,,,
"Ashton-under-Lyne.-A delegate meeting will be held in the Chartist room, Charlestown, near Ashton- under-Lyne, on Sunday, the 26th June, at ten o'clock in the morning, to take into consideration the best means of organising the district. Deputies from the following places are requested to attend:- Stalybridge, Hyde, Dukinfield, Mossley, Hooley-
hill, Droylsden, and Mottram.",,Ashton-Under-lyne,53.4945055,-2.0948135,7,Northern Star,18/06/1842,Meeting,,,
"Bingley District.-The next delegate meeting of the Bingley District will be held on Sunday, the 3rd of July, at ten o'clock in the forenoon, in the Foresters' Court, York-street, Bingley. It is particularly requested that all localities within the district
will send a delegate.",,Bingley District,53.8436535,-1.824621,7,Northern Star,25/06/1842,Meeting,,,
"A Public Meeting takes place here on Saturday, the 25th instant, Mr, David Ross will be invited.",,Bury,53.593,-2.298,7,Northern Star,25/06/1842,Meeting,,,
"Loughborough District Camp Meeting.- A camp meeting is to be held near tho Lower Mill, Loughborough, commonly called Boots Mill, on Sundav, the 26th of June, at three o'clock in the afternoon, when Messrs. Harrison of Calvercon, Beedham of Leicester; and Bairstow, Skevington, Pepper, and Jarrot are expected to attend. A camp meeting will also be held at Mount Sorrell,on Sunday, July 10th, at eleven o'clock in the forenoon; to adjourn at one, and meet again at half-past two in the afternoon; and a delegate meeting will be held at Mount Sorrell, for the county, the same day after dinner. ""That a district fund be made to defray the expences, and the accounts be examined every delegate meeting-that another delegate meeting be held at Loughborough, on Sunday, July 3rd, to arrange for the Mount Sorrell meeting-that any lecturer wishing to visit Loughborough,correspond with the Secretary, and wait for an answer before he be received, and bring his credentials with him from his own locality.""",,Loughborough District Camp Meeting,52.7723859,-1.2077985,7,Northern Star,25/06/1842,Meeting,,,
"Halifax.-A public meeting of this district will be held at Skirooat Moor, on Monday, June 27th, to take into consideration the propriety of remonstrating with the Legislature on their refusal, to listen to the prayers of three and a half millions of people, and to memorialize the Queen on doing justice to a starving and insulted people. F. O'Connor, Esq. and Mr. John West have kindly promised to attend, Mr. W, Beesley has been invited and is expected to attend also. Chair to be taken at half-past two o'clock, when every lover of freedom is expected to be at his post.-A lecture will be delivered in the evening by F. O'Cennor,Esq, in the Hall of Science, Gibbet-lane, to commence at eight o'olook.",,Halifax,53.725,-1.863,7,Northern Star,25/06/1842,Meeting,,,
"Mr. Cockburn will deliver lectures on the principles of the people's Charter, at the following places, next week-Morpeth, Tuesday, 28th June; Felton, Wednesday, 29th June; Alnwick, Thursday, 30th -June, and warkworth, Friday, 1st July. The hour of meeting to be appointed by the friends in each respective place, to suit the convenience of the industrious classes in their localities.",,Mr,,,7,Northern Star,25/06/1842,Tour,,,
"Frome.-Public Notice.-A delegate meeting will be held on the 3rd of July, in the Chartist Association Room, Catharine Hill, Frome, at ten o'clock in the forenoon. Delegates from Trowbridge, Warminster, Bradford, Milksham, Holt, Westbury, and the Deverels are expected to be present, as business of importance will be laid before them. Let there be a good attendance at this meeting.",,Frome,51.2270558,-2.3192971,7,Northern Star,25/06/1842,Meeting,,,
"Sheffield.-Mr. Clark, of Stockport, will address the Sheffield Chartists on Sunday, (to-morrow,) on the site of the Old Sugar Houses, top of Sheffield Moor, at half-past two o'clook ; and in the Hay-market, at seven o'clook. If the weather is unfavourable, the meetings will be holden in the Fig-tree-lane room.",,Sheffield,53.3840547,-1.4683069,7,Northern Star,25/06/1842,Meeting,,,
"A Lecture will be delivered at the above place, on Sunday, July the 10th, at eight o clock in the evening. ",,No,51.495397,-0.1126751,7,Northern Star,09/07/1842,Meeting,,,
"THURSTONLAND.   A lecture will bo delivered at Thurstonland, on Sunday, (to-morrow) by Edward Clayton. Chair to be taken at six o'clock. Discussion inviteed.",,Thurstonland,53.5899953,-1.7509898,7,Northern Star,09/07/1842,Meeting,,,
"HUDDERSFIELD.   The district delegate meeting of the General Councillors will be held in the house of Mr. Joseph Bray, Upperhead-row. Chair to be taken at one o clock.",,Huddersfield,53.6467031,-1.7832077,7,Northern Star,09/07/1842,Meeting,,,
"LEPTON, KIRKHEATON AND DALTON. - are requested to hand in the Petition Sheets which they have.",,"Lepton, Kirkheaton And Dalton",53.660129,-1.726188,7,Northern Star,09/07/1842,Meeting,,,
"NEW LEEDS, BRADFORD.   James Dewhurst will deliver his farewell lecture to the Chartists of New Leeds and its neighbourhood, on Sunday, July 10th, in the Chartist meeting room.",,"New Leeds, Bradford",53.8052862,-1.674413143,7,Northern Star,09/07/1842,Meeting,,,
"DEWSBURY.   A district council meeting will be held at the house of Mr. Charles Brook, Littletown, on Sunday, the 17th of July, at two o clock in the afternoon.",,Dewsbury,53.6909103,-1.6302142,7,Northern Star,09/07/1842,Meeting,,,
"LONDON.   Mr. Jones, the late West Riding lecturer, will lecture at the Working Men's Hall, 5, Circus-street, Now Road, Marylebone, on Sunday, the 17th inst, at half-past seven o'clock.",,London,51.5203722,-0.16248,7,Northern Star,16/07/1842,Meeting,,,
"A Great Out-door Public Meeting will be held at the Great Western Railway Station, on Monday, July the 18th, at seven o clock in the evening, to take into consideration the propriety of petitioning the House of Commons,and of memorializing her Majesty, through Sir James Graham, for a mitigation of the imprisonment of Brook and Peddie, in order to save them from the lamentable and horrid fate of Holberry, who died under the excruciating severity of the sentence, and oruel treatment, for the undefined crime of political conspiracy and sedition. The chair will be taken at seven o'clook precisely by a working man.",,Great Western railway station,51.516421,-0.17811,7,Northern Star,16/07/1842,Meeting,,,
"ALBION COFFEE-HOUSE, CHURCH STREET, SHOREDITCH.   A meeting of the members of this locality will take place, on Wednesday, the 20th of July ; and we earnestly request of every member to attend, as business of importance and of great interest to this locality is to be brought forward-  business which, if well performed, will enable us to assist the imprisoned, and likewise the families of the same, without any additional expence to the members.",,"Albion Coffee-house, Church Street, Shoreditch",51.5172361,-0.1032761,7,Northern Star,16/07/1842,Meeting,,,
"A lecture will be delivered at 1, China Walk Lambeth, on Sunday, July 17th, at half-past seven o clock.",,"A Lecture Will Be Delivered At 1, China Walk Lambeth, On Sunday, July 17th, At Half-past Seven O Clock",51.495397,-0.1126751,7,Northern Star,16/07/1842,Meeting,,,
Mr. Ferguson will lecture at the Three Crowns Richmond-street.,,Mr,51.511651,-0.133876,7,Northern Star,16/07/1842,Meeting,,,
"A Concert, Ball, and Lottery for an excellent violin, will take place on Monday, July 25th, at the splendid rooms of the Stag Tavern, Fulham-road, the proceeds to be given to the political victims. Tickets 9d. each. To commence at seven o clock.",,"A Concert, Ball, And Lottery For An Excellent Violin, Will Take Place On Monday, July 25th, At The Splendid Rooms Of The Stag Tavern, Fulham-road, The Proceeds To Be Given To The Political Victims",51.483448,-0.1851738,7,Northern Star,16/07/1842,Meeting,,,
"Ruffy Ridley having the sanction of the Executive to commence a lecturing tour in the South West of England, informs the different localities that he intends visiting Reading on Monday, July 25th; Abingdon, on the 28th; Oxford,27th; Banbury, 28th; Witney, 29th; Cheltenham, 30bh ana 31st; Gloucester, Monday, August 1st; Stroud, August 2nd ; from thence through Wiltshire to Bath, Bristol, and South Wales. Ruffy Ridley respectfully requests the various sub-Secretaries in his line of route, and the towns adjacent, to correspond immediately with at his residence, 18, D Oyley-street, Chelsea.",,"Ruffy Ridley Having The Sanction Of The Executive To Commence A Lecturing Tour In The South West Of England, Informs The Different Localities That He Intends Visiting Reading On Monday, July 25th; Abingdon, On The 28th; Oxford,27th; Banbury, 28th; Witney, 29th; Cheltenham, 30bh Ana 31st; Gloucester, Monday, August 1st; Stroud, August 2nd ; From Thence Through Wiltshire To Bath, Bristol, And South Wales",,,7,Northern Star,16/07/1842,Meeting,,,
"A Public Meeting will be held on Wednesday, evening next, at the Rising Sun, Oxford-street, Stepney. Several well-known advocates will attend. Working men, muster on this occasion, and shew io the factions that you are determined to obtain the Charter.",,"A Public Meeting Will Be Held On Wednesday, Evening Next, At The Rising Sun, Oxford-street, Stepney",51.5103576,-0.07051,7,Northern Star,16/07/1842,Meeting,,,
"A Concert and Ball, accompanied by a lottery, will be held at the splendid rooms of the Stag Tavern, Fulham Read, on Monday, July 25th, for the benefit of the political victims. Tickets, admitting to the whole, 9d. each.",,"A Concert And Ball, Accompanied By A Lottery, Will Be Held At The Splendid Rooms Of The Stag Tavern, Fulham Read, On Monday, July 25th, For The Benefit Of The Political Victims",51.483448,-0.1851738,7,Northern Star,16/07/1842,Meeting,,,
"DEWSBURY.   A district council meeting will be held at Littletown, on Sunday, (to-morrow), at the house' of Mr. Charles Brooks, at one o'clock in the afternoon.",,Dewsbury,53.6909103,-1.6302142,7,Northern Star,16/07/1842,Meeting,,,
"Mr. Mitchell, of Stockport, will lecture at the following places during the ensuing week:  this evening (Saturday, the 15th) at Compstall Bridge; Sunday, 16th, at Ashton-under-Lyne; Monday, 17th, at New Mills; Tuesday, 18th,at Glossop; Wednesday, 19th, at Mottram; Thursday, 20th, at Staly-bridge; Friday, 21st, at Mosley; Saturday, 22nd, at Hooley Hill; and on Sunday, 23rd, at Dukenfield.",,Mr,,,7,Northern Star,16/07/1842,Tour,,,
"Mr. West s Route for the ensuing Week.  On Monday, July 18th, at Burton; on Tuesday, the 19th, at Burton ; on Wednesday, the 20th, at Greasley Common; on Thursday, the 21st, at Burton; and on Friday, the 22ad, at Yoxall.",,Mr,,,7,Northern Star,16/07/1842,Tour,,,
"MANCHESTER.   Carpenter s Hall. On Sunday, (to-morrow) a general meeting of the members will he held in the above Hall. Business to commence at nine o clock precisely. It is requested that the members will attend, as there is business of import-ance to bring before the meeting.",,Manchester,53.4749,-2.23508,7,Northern Star,16/07/1842,Meeting,,,
"SHEFFIELD. - Mr. Thomas Cooper of Leicester, will preach twice on Sunday, July 17th, in the afternoon at two o clock, at West Bar, near West bar Green, and at seven o clock in the evening, (Holberry's funeral sermon) at Roscoe-fields.",,Sheffield,53.3840547,-1.4683069,7,Northern Star,16/07/1842,Meeting,,,
